{
  "results": [
    {
      "base_url": "https://www.cityofventura.ca.gov/AgendaCenter",
      "medias": [
        {
          "meeting_url": "https://www.youtube.com/watch?v=3uQyYOUPCSw",
          "agenda_url": "https://www.cityofventura.ca.gov/AgendaCenter/ViewFile/Agenda/_11182025-3529",
          "minutes_url": "https://www.cityofventura.ca.gov/AgendaCenter/ViewFile/Minutes/_11042025-3522",
          "title": "City Council Closed Session/Regular Meeting",
          "date": "2025-11-18"
        },
        {
          "meeting_url": "https://www.youtube.com/watch?v=3uQyYOUPCSw",
          "agenda_url": "https://www.cityofventura.ca.gov/AgendaCenter/ViewFile/Agenda/_11182025-3531",
          "minutes_url": "https://www.cityofventura.ca.gov/AgendaCenter/ViewFile/Minutes/_11042025-3522",
          "title": "18 DE NOVIEMBRE DE 2025 AGENDA DEL CONCEJO MUNICIPAL",
          "date": "2025-11-18"
        },
        {
          "meeting_url": "https://www.youtube.com/watch?v=3uQyYOUPCSw",
          "agenda_url": "https://www.cityofventura.ca.gov/AgendaCenter/ViewFile/Agenda/_11042025-3522",
          "minutes_url": "https://www.cityofventura.ca.gov/AgendaCenter/ViewFile/Minutes/_11042025-3522",
          "title": "City Council Closed Session/Regular Meeting",
          "date": "2025-11-04"
        },
        {
          "meeting_url": "https://www.youtube.com/watch?v=3uQyYOUPCSw",
          "agenda_url": "https://www.cityofventura.ca.gov/AgendaCenter/ViewFile/Agenda/_11042025-3525",
          "minutes_url": "https://www.cityofventura.ca.gov/AgendaCenter/ViewFile/Minutes/_11042025-3522",
          "title": "4 DE NOVIEMBRE DE 2025 AGENDA DEL CONCEJO MUNICIPAL",
          "date": "2025-11-04"
        },
        {
          "meeting_url": "https://www.youtube.com/watch?v=u-glN3YX4-0&list=PL_1f7aI4La-fIRN226r62egMt7LRputho&index=182",
          "agenda_url": "https://www.cityofventura.ca.gov/AgendaCenter/ViewFile/Agenda/_10212025-3517",
          "minutes_url": "https://www.cityofventura.ca.gov/AgendaCenter/ViewFile/Minutes/_10212025-3517",
          "title": "City Council Closed Session/Regular Meeting",
          "date": "2025-10-21"
        },
        {
          "meeting_url": "https://www.youtube.com/watch?v=3uQyYOUPCSw",
          "agenda_url": "https://www.cityofventura.ca.gov/AgendaCenter/ViewFile/Agenda/_10212025-3519",
          "minutes_url": "https://www.cityofventura.ca.gov/AgendaCenter/ViewFile/Minutes/_11042025-3522",
          "title": "21 DE OCTUBRE DE 2025 AGENDA DEL CONCEJO MUNICIPAL",
          "date": "2025-10-21"
        },
        {
          "meeting_url": "https://www.youtube.com/watch?v=_IQCDMrRTmk",
          "agenda_url": "https://www.cityofventura.ca.gov/AgendaCenter/ViewFile/Agenda/_10142025-3510",
          "minutes_url": "https://www.cityofventura.ca.gov/AgendaCenter/ViewFile/Minutes/_10142025-3510",
          "title": "City Council Closed Session/Regular Meeting",
          "date": "2025-10-14"
        },
        {
          "meeting_url": "https://www.youtube.com/watch?v=3uQyYOUPCSw",
          "agenda_url": "https://www.cityofventura.ca.gov/AgendaCenter/ViewFile/Agenda/_10142025-3514",
          "minutes_url": "https://www.cityofventura.ca.gov/AgendaCenter/ViewFile/Minutes/_11042025-3522",
          "title": "14 DE OCTUBRE DE 2025 AGENDA DEL CONCEJO MUNICIPAL",
          "date": "2025-10-14"
        },
        {
          "meeting_url": "https://www.youtube.com/watch?v=dclpjUTeBSw",
          "agenda_url": "https://www.cityofventura.ca.gov/AgendaCenter/ViewFile/Agenda/_10072025-3504",
          "minutes_url": "https://www.cityofventura.ca.gov/AgendaCenter/ViewFile/Minutes/_10072025-3504",
          "title": "City Council Closed Session/Regular Meeting",
          "date": "2025-10-07"
        },
        {
          "meeting_url": "https://www.youtube.com/watch?v=3uQyYOUPCSw",
          "agenda_url": "https://www.cityofventura.ca.gov/AgendaCenter/ViewFile/Agenda/_10072025-3506",
          "minutes_url": "https://www.cityofventura.ca.gov/AgendaCenter/ViewFile/Minutes/_11042025-3522",
          "title": "7 DE OCTUBRE DE 2025 AGENDA DEL CONCEJO MUNICIPAL",
          "date": "2025-10-07"
        },
        {
          "meeting_url": "https://www.youtube.com/watch?v=xFHQAOmu4dY&list=PL_1f7aI4La-fIRN226r62egMt7LRputho&index=180",
          "agenda_url": "https://www.cityofventura.ca.gov/AgendaCenter/ViewFile/Agenda/_09232025-3494",
          "minutes_url": "https://www.cityofventura.ca.gov/AgendaCenter/ViewFile/Minutes/_09232025-3494",
          "title": "City Council Closed Session/Regular Meeting",
          "date": "2025-09-23"
        },
        {
          "meeting_url": "https://www.youtube.com/watch?v=3uQyYOUPCSw",
          "agenda_url": "https://www.cityofventura.ca.gov/AgendaCenter/ViewFile/Agenda/_09232025-3495",
          "minutes_url": "https://www.cityofventura.ca.gov/AgendaCenter/ViewFile/Minutes/_11042025-3522",
          "title": "23 DE SEPTIEMBRE DE 2025 AGENDA DEL CONCEJO MUNICIPAL",
          "date": "2025-09-23"
        },
        {
          "meeting_url": "https://www.youtube.com/watch?v=eb3TXXCiTfA&list=PL_1f7aI4La-fIRN226r62egMt7LRputho&index=179",
          "agenda_url": "https://www.cityofventura.ca.gov/AgendaCenter/ViewFile/Agenda/_09162025-3490",
          "minutes_url": "https://www.cityofventura.ca.gov/AgendaCenter/ViewFile/Minutes/_09162025-3490",
          "title": "City Council Closed Session/Regular Meeting",
          "date": "2025-09-16"
        },
        {
          "meeting_url": "https://www.youtube.com/watch?v=3uQyYOUPCSw",
          "agenda_url": "https://www.cityofventura.ca.gov/AgendaCenter/ViewFile/Agenda/_09162025-3492",
          "minutes_url": "https://www.cityofventura.ca.gov/AgendaCenter/ViewFile/Minutes/_11042025-3522",
          "title": "16 DE SEPTIEMBRE DE 2025 AGENDA DEL CONCEJO MUNICIPAL",
          "date": "2025-09-16"
        },
        {
          "meeting_url": "https://www.youtube.com/watch?v=wYFuPv6bjtA ",
          "agenda_url": "https://www.cityofventura.ca.gov/AgendaCenter/ViewFile/Agenda/_08262025-3475",
          "minutes_url": "https://www.cityofventura.ca.gov/AgendaCenter/ViewFile/Minutes/_08262025-3475",
          "title": "City Council Closed Session/Regular Meeting",
          "date": "2025-08-26"
        },
        {
          "meeting_url": "https://www.youtube.com/watch?v=3uQyYOUPCSw",
          "agenda_url": "https://www.cityofventura.ca.gov/AgendaCenter/ViewFile/Agenda/_08262025-3477",
          "minutes_url": "https://www.cityofventura.ca.gov/AgendaCenter/ViewFile/Minutes/_11042025-3522",
          "title": "26 DE AGOSTO DE 2025 AGENDA DEL CONCEJO MUNICIPAL",
          "date": "2025-08-26"
        },
        {
          "meeting_url": "https://www.youtube.com/watch?v=3uQyYOUPCSw",
          "agenda_url": "https://www.cityofventura.ca.gov/AgendaCenter/ViewFile/Agenda/_08192025-3469",
          "minutes_url": "https://www.cityofventura.ca.gov/AgendaCenter/ViewFile/Minutes/_11042025-3522",
          "title": "City Council Regular Meeting - Notice of Meeting Type Change",
          "date": "2025-08-19"
        },
        {
          "meeting_url": "https://www.youtube.com/watch?v=1m1CaZgUCZI",
          "agenda_url": "https://www.cityofventura.ca.gov/AgendaCenter/ViewFile/Agenda/_08192025-3470",
          "minutes_url": "https://www.cityofventura.ca.gov/AgendaCenter/ViewFile/Minutes/_08192025-3470",
          "title": "City Council Closed Session/Special Meeting",
          "date": "2025-08-19"
        },
        {
          "meeting_url": "https://www.youtube.com/watch?v=3uQyYOUPCSw",
          "agenda_url": "https://www.cityofventura.ca.gov/AgendaCenter/ViewFile/Agenda/_08192025-3472",
          "minutes_url": "https://www.cityofventura.ca.gov/AgendaCenter/ViewFile/Minutes/_11042025-3522",
          "title": "19 DE AGOSTO DE 2025 AGENDA DEL CONCEJO MUNICIPAL",
          "date": "2025-08-19"
        },
        {
          "meeting_url": "https://www.youtube.com/watch?v=uxv0q_9-F_8&list=PL_1f7aI4La-fIRN226r62egMt7LRputho&index=176",
          "agenda_url": "https://www.cityofventura.ca.gov/AgendaCenter/ViewFile/Agenda/_07092025-3446",
          "minutes_url": "https://www.cityofventura.ca.gov/AgendaCenter/ViewFile/Minutes/_07092025-3446",
          "title": "City Council Closed Session/Special Meeting",
          "date": "2025-07-09"
        },
        {
          "meeting_url": "https://www.youtube.com/watch?v=3uQyYOUPCSw",
          "agenda_url": "https://www.cityofventura.ca.gov/AgendaCenter/ViewFile/Agenda/_07092025-3447",
          "minutes_url": "https://www.cityofventura.ca.gov/AgendaCenter/ViewFile/Minutes/_11042025-3522",
          "title": "9 DE JULIO DE 2025 AGENDA DEL CONCEJO MUNICIPAL",
          "date": "2025-07-09"
        },
        {
          "meeting_url": "https://www.youtube.com/watch?v=Qw1Lpz-pQ7E",
          "agenda_url": "https://www.cityofventura.ca.gov/AgendaCenter/ViewFile/Agenda/_07082025-3442",
          "minutes_url": "https://www.cityofventura.ca.gov/AgendaCenter/ViewFile/Minutes/_07082025-3442",
          "title": "City Council Closed Session/Regular Meeting",
          "date": "2025-07-08"
        },
        {
          "meeting_url": "https://www.youtube.com/watch?v=3uQyYOUPCSw",
          "agenda_url": "https://www.cityofventura.ca.gov/AgendaCenter/ViewFile/Agenda/_07082025-3443",
          "minutes_url": "https://www.cityofventura.ca.gov/AgendaCenter/ViewFile/Minutes/_11042025-3522",
          "title": "8 DE JULIO DE 2025 AGENDA DEL CONCEJO MUNICIPAL",
          "date": "2025-07-08"
        },
        {
          "meeting_url": "https://www.youtube.com/watch?v=KZvggWku3GQ",
          "agenda_url": "https://www.cityofventura.ca.gov/AgendaCenter/ViewFile/Agenda/_07012025-3438",
          "minutes_url": "https://www.cityofventura.ca.gov/AgendaCenter/ViewFile/Minutes/_07012025-3438",
          "title": "City Council Closed Session/Regular Meeting",
          "date": "2025-07-01"
        },
        {
          "meeting_url": "https://www.youtube.com/watch?v=3uQyYOUPCSw",
          "agenda_url": "https://www.cityofventura.ca.gov/AgendaCenter/ViewFile/Agenda/_07012025-3439",
          "minutes_url": "https://www.cityofventura.ca.gov/AgendaCenter/ViewFile/Minutes/_11042025-3522",
          "title": "1 DE JULIO DE 2025 AGENDA DEL CONCEJO MUNICIPAL",
          "date": "2025-07-01"
        },
        {
          "meeting_url": "https://www.youtube.com/watch?v=ARnP-jFb4gg",
          "agenda_url": "https://www.cityofventura.ca.gov/AgendaCenter/ViewFile/Agenda/_06262025-3435",
          "minutes_url": "https://www.cityofventura.ca.gov/AgendaCenter/ViewFile/Minutes/_06262025-3435",
          "title": "City Council Special Meeting",
          "date": "2025-06-26"
        },
        {
          "meeting_url": "https://www.youtube.com/watch?v=3uQyYOUPCSw",
          "agenda_url": "https://www.cityofventura.ca.gov/AgendaCenter/ViewFile/Agenda/_06262025-3436",
          "minutes_url": "https://www.cityofventura.ca.gov/AgendaCenter/ViewFile/Minutes/_11042025-3522",
          "title": "26 DE JUNIO DE 2025 AGENDA DEL CONCEJO MUNICIPAL",
          "date": "2025-06-26"
        },
        {
          "meeting_url": "https://www.youtube.com/watch?v=kIU7qMv-GgI&t=13209s",
          "agenda_url": "https://www.cityofventura.ca.gov/AgendaCenter/ViewFile/Agenda/_06242025-3432",
          "minutes_url": "https://www.cityofventura.ca.gov/AgendaCenter/ViewFile/Minutes/_06242025-3432",
          "title": "City Council Closed Session/Regular Meeting",
          "date": "2025-06-24"
        },
        {
          "meeting_url": "https://www.youtube.com/watch?v=3uQyYOUPCSw",
          "agenda_url": "https://www.cityofventura.ca.gov/AgendaCenter/ViewFile/Agenda/_06242025-3433",
          "minutes_url": "https://www.cityofventura.ca.gov/AgendaCenter/ViewFile/Minutes/_11042025-3522",
          "title": "24 DE JUNIO DE 2025 AGENDA DEL CONCEJO MUNICIPAL",
          "date": "2025-06-24"
        },
        {
          "meeting_url": "https://www.youtube.com/watch?v=9M71qYxJmII&list=PL_1f7aI4La-fIRN226r62egMt7LRputho&index=171",
          "agenda_url": "https://www.cityofventura.ca.gov/AgendaCenter/ViewFile/Agenda/_06102025-3420",
          "minutes_url": "https://www.cityofventura.ca.gov/AgendaCenter/ViewFile/Minutes/_06102025-3420",
          "title": "City Council Regular Meeting",
          "date": "2025-06-10"
        },
        {
          "meeting_url": "https://www.youtube.com/watch?v=3uQyYOUPCSw",
          "agenda_url": "https://www.cityofventura.ca.gov/AgendaCenter/ViewFile/Agenda/_06102025-3421",
          "minutes_url": "https://www.cityofventura.ca.gov/AgendaCenter/ViewFile/Minutes/_11042025-3522",
          "title": "10 DE JUNIO DE 2025 AGENDA DEL CONCEJO MUNICIPAL",
          "date": "2025-06-10"
        },
        {
          "meeting_url": "https://www.youtube.com/watch?v=bHaBnDfFApw&list=PL_1f7aI4La-fIRN226r62egMt7LRputho&index=1",
          "agenda_url": "https://www.cityofventura.ca.gov/AgendaCenter/ViewFile/Agenda/_05272025-3414",
          "minutes_url": "https://www.cityofventura.ca.gov/AgendaCenter/ViewFile/Minutes/_05272025-3414",
          "title": "City Council Closed Session/Regular Meeting",
          "date": "2025-05-27"
        },
        {
          "meeting_url": "https://www.youtube.com/watch?v=3uQyYOUPCSw",
          "agenda_url": "https://www.cityofventura.ca.gov/AgendaCenter/ViewFile/Agenda/_05272025-3416",
          "minutes_url": "https://www.cityofventura.ca.gov/AgendaCenter/ViewFile/Minutes/_11042025-3522",
          "title": "27 DE MAYO DE 2025 AGENDA DEL CONCEJO MUNICIPAL",
          "date": "2025-05-27"
        },
        {
          "meeting_url": "https://www.youtube.com/watch?v=ppmtrZCg4T0&list=PL_1f7aI4La-fIRN226r62egMt7LRputho&index=2",
          "agenda_url": "https://www.cityofventura.ca.gov/AgendaCenter/ViewFile/Agenda/_05152025-3402",
          "minutes_url": "https://www.cityofventura.ca.gov/AgendaCenter/ViewFile/Minutes/_05152025-3402",
          "title": "City Council Special Meeting - General Plan",
          "date": "2025-05-15"
        },
        {
          "meeting_url": "https://www.youtube.com/watch?v=3uQyYOUPCSw",
          "agenda_url": "https://www.cityofventura.ca.gov/AgendaCenter/ViewFile/Agenda/_05152025-3407",
          "minutes_url": "https://www.cityofventura.ca.gov/AgendaCenter/ViewFile/Minutes/_11042025-3522",
          "title": "15 DE MAYO DE 2025 AGENDA DEL CONCEJO MUNICIPAL",
          "date": "2025-05-15"
        },
        {
          "meeting_url": "https://www.youtube.com/watch?v=8WkYTTpZlXg&list=PL_1f7aI4La-fIRN226r62egMt7LRputho&index=3",
          "agenda_url": "https://www.cityofventura.ca.gov/AgendaCenter/ViewFile/Agenda/_05142025-3401",
          "minutes_url": "https://www.cityofventura.ca.gov/AgendaCenter/ViewFile/Minutes/_05142025-3401",
          "title": "City Council Special Meeting - General Plan",
          "date": "2025-05-14"
        },
        {
          "meeting_url": "https://www.youtube.com/watch?v=3uQyYOUPCSw",
          "agenda_url": "https://www.cityofventura.ca.gov/AgendaCenter/ViewFile/Agenda/_05142025-3406",
          "minutes_url": "https://www.cityofventura.ca.gov/AgendaCenter/ViewFile/Minutes/_11042025-3522",
          "title": "14 DE MAYO DE 2025 AGENDA DEL CONCEJO MUNICIPAL",
          "date": "2025-05-14"
        },
        {
          "meeting_url": "https://www.youtube.com/watch?v=3uQyYOUPCSw",
          "agenda_url": "https://www.cityofventura.ca.gov/AgendaCenter/ViewFile/Agenda/_05132025-3404",
          "minutes_url": "https://www.cityofventura.ca.gov/AgendaCenter/ViewFile/Minutes/_11042025-3522",
          "title": "13 DE MAYO DE 2025 AGENDA DEL CONCEJO MUNICIPAL",
          "date": "2025-05-13"
        },
        {
          "meeting_url": "https://www.youtube.com/watch?v=-7xr_lYIQ-c&list=PL_1f7aI4La-fIRN226r62egMt7LRputho&index=4",
          "agenda_url": "https://www.cityofventura.ca.gov/AgendaCenter/ViewFile/Agenda/_05132025-3400",
          "minutes_url": "https://www.cityofventura.ca.gov/AgendaCenter/ViewFile/Minutes/_05132025-3400",
          "title": "City Council Closed Session/Regular Meeting",
          "date": "2025-05-13"
        },
        {
          "meeting_url": "https://www.youtube.com/watch?v=zowT8p6O4SE&list=PL_1f7aI4La-fIRN226r62egMt7LRputho&index=5",
          "agenda_url": "https://www.cityofventura.ca.gov/AgendaCenter/ViewFile/Agenda/_05062025-3395",
          "minutes_url": "https://www.cityofventura.ca.gov/AgendaCenter/ViewFile/Minutes/_05062025-3395",
          "title": "City Council Closed Session/Regular Meeting",
          "date": "2025-05-06"
        },
        {
          "meeting_url": "https://www.youtube.com/watch?v=3uQyYOUPCSw",
          "agenda_url": "https://www.cityofventura.ca.gov/AgendaCenter/ViewFile/Agenda/_05062025-3398",
          "minutes_url": "https://www.cityofventura.ca.gov/AgendaCenter/ViewFile/Minutes/_11042025-3522",
          "title": "6 DE MAYO DE 2025 AGENDA DEL CONCEJO MUNICIPAL",
          "date": "2025-05-06"
        },
        {
          "meeting_url": "https://www.youtube.com/watch?v=3uQyYOUPCSw",
          "agenda_url": "https://www.cityofventura.ca.gov/AgendaCenter/ViewFile/Agenda/_04242025-3390",
          "minutes_url": "https://www.cityofventura.ca.gov/AgendaCenter/ViewFile/Minutes/_04242025-3390",
          "title": "City Council Closed Session Special Meeting",
          "date": "2025-04-24"
        },
        {
          "meeting_url": "https://www.youtube.com/watch?v=iPE034ou97g&list=PL_1f7aI4La-fIRN226r62egMt7LRputho&index=7",
          "agenda_url": "https://www.cityofventura.ca.gov/AgendaCenter/ViewFile/Agenda/_04222025-3386",
          "minutes_url": "https://www.cityofventura.ca.gov/AgendaCenter/ViewFile/Minutes/_04222025-3386",
          "title": "City Council Closed Session/Regular Meeting",
          "date": "2025-04-22"
        },
        {
          "meeting_url": "https://www.youtube.com/watch?v=3uQyYOUPCSw",
          "agenda_url": "https://www.cityofventura.ca.gov/AgendaCenter/ViewFile/Agenda/_04222025-3387",
          "minutes_url": "https://www.cityofventura.ca.gov/AgendaCenter/ViewFile/Minutes/_11042025-3522",
          "title": "22 DE ABRIL DE 2025 AGENDA DEL CONCEJO MUNICIPAL",
          "date": "2025-04-22"
        },
        {
          "meeting_url": "https://www.youtube.com/watch?v=7v2NRc8AGg4&list=PL_1f7aI4La-fIRN226r62egMt7LRputho&index=8",
          "agenda_url": "https://www.cityofventura.ca.gov/AgendaCenter/ViewFile/Agenda/_04082025-3375",
          "minutes_url": "https://www.cityofventura.ca.gov/AgendaCenter/ViewFile/Minutes/_04082025-3375",
          "title": "City Council Closed Session/Regular Meeting - Supplemental Packet Posted",
          "date": "2025-04-08"
        },
        {
          "meeting_url": "https://www.youtube.com/watch?v=3uQyYOUPCSw",
          "agenda_url": "https://www.cityofventura.ca.gov/AgendaCenter/ViewFile/Agenda/_04082025-3376",
          "minutes_url": "https://www.cityofventura.ca.gov/AgendaCenter/ViewFile/Minutes/_11042025-3522",
          "title": "8 DE ABRIL DE 2025 AGENDA DEL CONCEJO MUNICIPAL",
          "date": "2025-04-08"
        },
        {
          "meeting_url": "https://www.youtube.com/watch?v=p-0PgfT5hdI&list=PL_1f7aI4La-fIRN226r62egMt7LRputho&index=9",
          "agenda_url": "https://www.cityofventura.ca.gov/AgendaCenter/ViewFile/Agenda/_03252025-3369",
          "minutes_url": "https://www.cityofventura.ca.gov/AgendaCenter/ViewFile/Minutes/_03252025-3369",
          "title": "City Council Closed Session/Regular Meeting - Supplemental Packet Posted",
          "date": "2025-03-25"
        },
        {
          "meeting_url": "https://www.youtube.com/watch?v=3uQyYOUPCSw",
          "agenda_url": "https://www.cityofventura.ca.gov/AgendaCenter/ViewFile/Agenda/_03252025-3370",
          "minutes_url": "https://www.cityofventura.ca.gov/AgendaCenter/ViewFile/Minutes/_11042025-3522",
          "title": "25 DE MARZO DE 2025 AGENDA DEL CONCEJO MUNICIPAL",
          "date": "2025-03-25"
        },
        {
          "meeting_url": "https://www.youtube.com/watch?v=_n1EsuyoEI8&t=716s",
          "agenda_url": "https://www.cityofventura.ca.gov/AgendaCenter/ViewFile/Agenda/_03182025-3362",
          "minutes_url": "https://www.cityofventura.ca.gov/AgendaCenter/ViewFile/Minutes/_03182025-3362",
          "title": "City Council Closed Session/Regular Meeting - Supplemental Packet Posted",
          "date": "2025-03-18"
        },
        {
          "meeting_url": "https://www.youtube.com/watch?v=3uQyYOUPCSw",
          "agenda_url": "https://www.cityofventura.ca.gov/AgendaCenter/ViewFile/Agenda/_03182025-3366",
          "minutes_url": "https://www.cityofventura.ca.gov/AgendaCenter/ViewFile/Minutes/_11042025-3522",
          "title": "18 DE MARZO DE 2025 AGENDA DEL CONCEJO MUNICIPAL",
          "date": "2025-03-18"
        },
        {
          "meeting_url": "https://www.youtube.com/watch?v=fPxif-_v43g&list=PL_1f7aI4La-fIRN226r62egMt7LRputho&index=3",
          "agenda_url": "https://www.cityofventura.ca.gov/AgendaCenter/ViewFile/Agenda/_02252025-3352",
          "minutes_url": "https://www.cityofventura.ca.gov/AgendaCenter/ViewFile/Minutes/_02252025-3352",
          "title": "City Council Closed Session/Regular Meeting - Supplemental Packet Posted",
          "date": "2025-02-25"
        },
        {
          "meeting_url": "https://www.youtube.com/watch?v=3uQyYOUPCSw",
          "agenda_url": "https://www.cityofventura.ca.gov/AgendaCenter/ViewFile/Agenda/_02252025-3353",
          "minutes_url": "https://www.cityofventura.ca.gov/AgendaCenter/ViewFile/Minutes/_11042025-3522",
          "title": "25 DE FEBRERO DE 2025 AGENDA DEL CONCEJO MUNICIPAL",
          "date": "2025-02-25"
        },
        {
          "meeting_url": "https://www.youtube.com/watch?v=P8DJYFnLq9w&list=PL_1f7aI4La-fIRN226r62egMt7LRputho&index=4",
          "agenda_url": "https://www.cityofventura.ca.gov/AgendaCenter/ViewFile/Agenda/_02112025-3343",
          "minutes_url": "https://www.cityofventura.ca.gov/AgendaCenter/ViewFile/Minutes/_02112025-3343",
          "title": "City Council Closed Session/Regular Meeting - Supplemental Packet Posted",
          "date": "2025-02-11"
        },
        {
          "meeting_url": "https://www.youtube.com/watch?v=3uQyYOUPCSw",
          "agenda_url": "https://www.cityofventura.ca.gov/AgendaCenter/ViewFile/Agenda/_02112025-3344",
          "minutes_url": "https://www.cityofventura.ca.gov/AgendaCenter/ViewFile/Minutes/_11042025-3522",
          "title": "11 DE FEBRERO DE 2025 AGENDA DEL CONCEJO MUNICIPAL",
          "date": "2025-02-11"
        },
        {
          "meeting_url": "https://www.youtube.com/watch?v=WEcAwtZcmmQ&list=PL_1f7aI4La-fIRN226r62egMt7LRputho&index=5",
          "agenda_url": "https://www.cityofventura.ca.gov/AgendaCenter/ViewFile/Agenda/_02012025-3336",
          "minutes_url": "https://www.cityofventura.ca.gov/AgendaCenter/ViewFile/Minutes/_02012025-3336",
          "title": "City Council Strategic Priority Setting Meeting - Supplemental Packet Posted",
          "date": "2025-02-01"
        },
        {
          "meeting_url": "https://www.youtube.com/watch?v=3uQyYOUPCSw",
          "agenda_url": "https://www.cityofventura.ca.gov/AgendaCenter/ViewFile/Agenda/_02012025-3337",
          "minutes_url": "https://www.cityofventura.ca.gov/AgendaCenter/ViewFile/Minutes/_11042025-3522",
          "title": "Meeting on 2025-02-01",
          "date": "2025-02-01"
        },
        {
          "meeting_url": "https://www.youtube.com/watch?v=kR735x3XCjE&list=PL_1f7aI4La-fIRN226r62egMt7LRputho&index=7",
          "agenda_url": "https://www.cityofventura.ca.gov/AgendaCenter/ViewFile/Agenda/_01282025-3332",
          "minutes_url": "https://www.cityofventura.ca.gov/AgendaCenter/ViewFile/Minutes/_01282025-3332",
          "title": "City Council Closed Session/Regular Meeting - Supplemental Packet Posted",
          "date": "2025-01-28"
        },
        {
          "meeting_url": "https://www.youtube.com/watch?v=3uQyYOUPCSw",
          "agenda_url": "https://www.cityofventura.ca.gov/AgendaCenter/ViewFile/Agenda/_01282025-3334",
          "minutes_url": "https://www.cityofventura.ca.gov/AgendaCenter/ViewFile/Minutes/_11042025-3522",
          "title": "28 DE ENERO DE 2025 AGENDA DEL CONCEJO MUNICIPAL",
          "date": "2025-01-28"
        },
        {
          "meeting_url": "https://www.youtube.com/watch?v=xT3taDU7aog&list=PL_1f7aI4La-fIRN226r62egMt7LRputho&index=10",
          "agenda_url": "https://www.cityofventura.ca.gov/AgendaCenter/ViewFile/Agenda/_01212025-3328",
          "minutes_url": "https://www.cityofventura.ca.gov/AgendaCenter/ViewFile/Minutes/_01212025-3328",
          "title": "City Council Closed Session/Regular Meeting - Supplemental Packet Posted",
          "date": "2025-01-21"
        },
        {
          "meeting_url": "https://www.youtube.com/watch?v=3uQyYOUPCSw",
          "agenda_url": "https://www.cityofventura.ca.gov/AgendaCenter/ViewFile/Agenda/_01212025-3329",
          "minutes_url": "https://www.cityofventura.ca.gov/AgendaCenter/ViewFile/Minutes/_11042025-3522",
          "title": "21 DE ENERO DE 2025 AGENDA DEL CONCEJO MUNICIPAL",
          "date": "2025-01-21"
        },
        {
          "meeting_url": "https://www.youtube.com/watch?v=LfOU0LP0-0A&list=PL_1f7aI4La-fIRN226r62egMt7LRputho&index=11",
          "agenda_url": "https://www.cityofventura.ca.gov/AgendaCenter/ViewFile/Agenda/_01142025-3323",
          "minutes_url": "https://www.cityofventura.ca.gov/AgendaCenter/ViewFile/Minutes/_01142025-3323",
          "title": "City Council Closed Session/Regular Meeting - Supplemental Packet Posted",
          "date": "2025-01-14"
        },
        {
          "meeting_url": "https://www.youtube.com/watch?v=3uQyYOUPCSw",
          "agenda_url": "https://www.cityofventura.ca.gov/AgendaCenter/ViewFile/Agenda/_01142025-3325",
          "minutes_url": "https://www.cityofventura.ca.gov/AgendaCenter/ViewFile/Minutes/_11042025-3522",
          "title": "14 DE ENERO DE 2025 AGENDA DEL CONCEJO MUNICIPAL",
          "date": "2025-01-14"
        },
        {
          "meeting_url": null,
          "agenda_url": "https://www.cityofventura.ca.gov/AgendaCenter/ViewFile/Agenda/_09032025-3484",
          "minutes_url": "https://www.cityofventura.ca.gov/AgendaCenter/ViewFile/Minutes/_09032025-3484",
          "title": "Appointments Recommendation Committee Special Meeting",
          "date": "2025-09-03"
        },
        {
          "meeting_url": null,
          "agenda_url": "https://www.cityofventura.ca.gov/AgendaCenter/ViewFile/Agenda/_08152025-3466",
          "minutes_url": "https://www.cityofventura.ca.gov/AgendaCenter/ViewFile/Minutes/_08152025-3466",
          "title": "Appointments Recommendation Committee Special Meeting",
          "date": "2025-08-15"
        },
        {
          "meeting_url": "https://cityofventura.granicus.com/MediaPlayer.php?view_id=17&clip_id=2846",
          "agenda_url": "https://www.cityofventura.ca.gov/AgendaCenter/ViewFile/Agenda/_11132025-3528",
          "minutes_url": "https://www.cityofventura.ca.gov/AgendaCenter/ViewFile/Minutes/_10092025-3505",
          "title": "Arts and Culture Commission Regular Meeting (11/13/2025)",
          "date": "2025-11-13"
        },
        {
          "meeting_url": "https://cityofventura.granicus.com/MediaPlayer.php?view_id=17&clip_id=2839",
          "agenda_url": "https://www.cityofventura.ca.gov/AgendaCenter/ViewFile/Agenda/_10092025-3505",
          "minutes_url": "https://www.cityofventura.ca.gov/AgendaCenter/ViewFile/Minutes/_10092025-3505",
          "title": "Arts and Culture Commission Regular Meeting (10/09/2025)",
          "date": "2025-10-09"
        },
        {
          "meeting_url": "https://cityofventura.granicus.com/MediaPlayer.php?view_id=17&clip_id=2846",
          "agenda_url": "https://www.cityofventura.ca.gov/AgendaCenter/ViewFile/Agenda/_09112025-3488",
          "minutes_url": "https://www.cityofventura.ca.gov/AgendaCenter/ViewFile/Minutes/_09112025-3488",
          "title": "Arts and Culture Commission Regular Meeting (9/11/2025)",
          "date": "2025-09-11"
        },
        {
          "meeting_url": "https://cityofventura.granicus.com/MediaPlayer.php?view_id=17&clip_id=2846",
          "agenda_url": "https://www.cityofventura.ca.gov/AgendaCenter/ViewFile/Agenda/_08142025-3471",
          "minutes_url": "https://www.cityofventura.ca.gov/AgendaCenter/ViewFile/Minutes/_10092025-3505",
          "title": "Arts and Culture Commission Supplemental Packet 2 (8/14/2025)",
          "date": "2025-08-14"
        },
        {
          "meeting_url": "https://cityofventura.granicus.com/MediaPlayer.php?view_id=17&clip_id=2846",
          "agenda_url": "https://www.cityofventura.ca.gov/AgendaCenter/ViewFile/Agenda/_08142025-3476",
          "minutes_url": "https://www.cityofventura.ca.gov/AgendaCenter/ViewFile/Minutes/_10092025-3505",
          "title": "Arts and Culture Commission Supplemental Packet 3 (8/14/2025)",
          "date": "2025-08-14"
        },
        {
          "meeting_url": "https://cityofventura.granicus.com/MediaPlayer.php?view_id=17&clip_id=2846",
          "agenda_url": "https://www.cityofventura.ca.gov/AgendaCenter/ViewFile/Agenda/_08142025-3454",
          "minutes_url": "https://www.cityofventura.ca.gov/AgendaCenter/ViewFile/Minutes/_10092025-3505",
          "title": "Arts and Culture Commission Regular Meeting (08/14/2025)",
          "date": "2025-08-14"
        },
        {
          "meeting_url": "https://cityofventura.granicus.com/MediaPlayer.php?view_id=17&clip_id=2846",
          "agenda_url": "https://www.cityofventura.ca.gov/AgendaCenter/ViewFile/Agenda/_08142025-3462",
          "minutes_url": "https://www.cityofventura.ca.gov/AgendaCenter/ViewFile/Minutes/_10092025-3505",
          "title": "Arts and Culture Commission Supplemental Packet 1 (8/14/2025)",
          "date": "2025-08-14"
        },
        {
          "meeting_url": "https://cityofventura.granicus.com/MediaPlayer.php?view_id=17&clip_id=2846",
          "agenda_url": "https://www.cityofventura.ca.gov/AgendaCenter/ViewFile/Agenda/_07102025-3463",
          "minutes_url": "https://www.cityofventura.ca.gov/AgendaCenter/ViewFile/Minutes/_10092025-3505",
          "title": "Arts and Culture Commission Supplemental Packet 2 (7/10/2025)",
          "date": "2025-07-10"
        },
        {
          "meeting_url": "https://cityofventura.granicus.com/MediaPlayer.php?view_id=17&clip_id=2846",
          "agenda_url": "https://www.cityofventura.ca.gov/AgendaCenter/ViewFile/Agenda/_07102025-3448",
          "minutes_url": "https://www.cityofventura.ca.gov/AgendaCenter/ViewFile/Minutes/_07102025-3448",
          "title": "Arts and Culture Commission Regular Meeting (07/10/2025)",
          "date": "2025-07-10"
        },
        {
          "meeting_url": "https://cityofventura.granicus.com/MediaPlayer.php?view_id=17&clip_id=2846",
          "agenda_url": "https://www.cityofventura.ca.gov/AgendaCenter/ViewFile/Agenda/_07102025-3452",
          "minutes_url": "https://www.cityofventura.ca.gov/AgendaCenter/ViewFile/Minutes/_10092025-3505",
          "title": "Arts and Culture Commission Supplemental Packet 1 (7/10/2025)",
          "date": "2025-07-10"
        },
        {
          "meeting_url": "https://cityofventura.granicus.com/MediaPlayer.php?view_id=17&clip_id=2846",
          "agenda_url": "https://www.cityofventura.ca.gov/AgendaCenter/ViewFile/Agenda/_05082025-3399",
          "minutes_url": "https://www.cityofventura.ca.gov/AgendaCenter/ViewFile/Minutes/_05082025-3399",
          "title": "Arts and Culture Commission Regular Meeting (05/8/2025)",
          "date": "2025-05-08"
        },
        {
          "meeting_url": "https://cityofventura.granicus.com/MediaPlayer.php?view_id=17&clip_id=2846",
          "agenda_url": "https://www.cityofventura.ca.gov/AgendaCenter/ViewFile/Agenda/_04102025-3378",
          "minutes_url": "https://www.cityofventura.ca.gov/AgendaCenter/ViewFile/Minutes/_04102025-3378",
          "title": "Arts and Culture Commission Regular Meeting (04/10/2025)",
          "date": "2025-04-10"
        },
        {
          "meeting_url": "https://cityofventura.granicus.com/MediaPlayer.php?view_id=17&clip_id=2846",
          "agenda_url": "https://www.cityofventura.ca.gov/AgendaCenter/ViewFile/Agenda/_03132025-3358",
          "minutes_url": "https://www.cityofventura.ca.gov/AgendaCenter/ViewFile/Minutes/_03132025-3358",
          "title": "Arts and Culture Commission Regular Meeting (03/13/2025)",
          "date": "2025-03-13"
        },
        {
          "meeting_url": "https://cityofventura.granicus.com/MediaPlayer.php?view_id=17&clip_id=2846",
          "agenda_url": "https://www.cityofventura.ca.gov/AgendaCenter/ViewFile/Agenda/_03132025-3363",
          "minutes_url": "https://www.cityofventura.ca.gov/AgendaCenter/ViewFile/Minutes/_10092025-3505",
          "title": "Arts and Culture Commission Supplemental Packet for 3-13-2025",
          "date": "2025-03-13"
        },
        {
          "meeting_url": "https://cityofventura.granicus.com/MediaPlayer.php?view_id=17&clip_id=2846",
          "agenda_url": "https://www.cityofventura.ca.gov/AgendaCenter/ViewFile/Agenda/_02132025-3339",
          "minutes_url": "https://www.cityofventura.ca.gov/AgendaCenter/ViewFile/Minutes/_02132025-3339",
          "title": "Arts and Culture Commission Regular Meeting (02/13/2025)",
          "date": "2025-02-13"
        },
        {
          "meeting_url": "https://cityofventura.granicus.com/MediaPlayer.php?view_id=17&clip_id=2846",
          "agenda_url": "https://www.cityofventura.ca.gov/AgendaCenter/ViewFile/Agenda/_01092025-3319",
          "minutes_url": "https://www.cityofventura.ca.gov/AgendaCenter/ViewFile/Minutes/_01092025-3319",
          "title": "Arts and Culture Commission Regular Meeting (01/09/2025)",
          "date": "2025-01-09"
        },
        {
          "meeting_url": "https://www.youtube.com/watch?v=y3qAcylnFzo",
          "agenda_url": "https://www.cityofventura.ca.gov/AgendaCenter/ViewFile/Agenda/_02062025-3341",
          "minutes_url": "https://www.cityofventura.ca.gov/AgendaCenter/ViewFile/Minutes/_02062025-3341",
          "title": "City Council Streetlighting Ad Hoc Committee Meeting",
          "date": "2025-02-06"
        },
        {
          "meeting_url": "https://www.youtube.com/watch?v=zO2EXoDpwBc",
          "agenda_url": "https://www.cityofventura.ca.gov/AgendaCenter/ViewFile/Agenda/_01292025-3333",
          "minutes_url": "https://www.cityofventura.ca.gov/AgendaCenter/ViewFile/Minutes/_01292025-3333",
          "title": "City Council Streetlighting Ad Hoc Committee Meeting",
          "date": "2025-01-29"
        },
        {
          "meeting_url": "https://www.youtube.com/watch?v=2P9eZmt6GAk",
          "agenda_url": "https://www.cityofventura.ca.gov/AgendaCenter/ViewFile/Agenda/_07072025-3445",
          "minutes_url": "https://www.cityofventura.ca.gov/AgendaCenter/ViewFile/Minutes/_07072025-3445",
          "title": "City Council Rules Committee Regular Meeting",
          "date": "2025-07-07"
        },
        {
          "meeting_url": "https://www.youtube.com/watch?v=DVhvP19SFVo&t=894s",
          "agenda_url": "https://www.cityofventura.ca.gov/AgendaCenter/ViewFile/Agenda/_06022025-3418",
          "minutes_url": "https://www.cityofventura.ca.gov/AgendaCenter/ViewFile/Minutes/_06022025-3418",
          "title": "City Council Rules Committee Special Meeting",
          "date": "2025-05-29"
        },
        {
          "meeting_url": "https://www.youtube.com/watch?v=xNisCkb62Ok&t=17s",
          "agenda_url": "https://www.cityofventura.ca.gov/AgendaCenter/ViewFile/Agenda/_04142025-3382",
          "minutes_url": "https://www.cityofventura.ca.gov/AgendaCenter/ViewFile/Minutes/_04142025-3382",
          "title": "City Council Rules Committee Regular Meeting",
          "date": "2025-04-14"
        },
        {
          "meeting_url": "https://www.youtube.com/watch?v=lRGIlhPXfaM",
          "agenda_url": "https://www.cityofventura.ca.gov/AgendaCenter/ViewFile/Agenda/_02102025-3347",
          "minutes_url": "https://www.cityofventura.ca.gov/AgendaCenter/ViewFile/Minutes/_02102025-3347",
          "title": "City Council Rules Committee Special Meeting",
          "date": "2025-02-10"
        },
        {
          "meeting_url": "https://www.youtube.com/live/ZdRwqSr8sdM?si=uI5pFQf3ibwzH1rz",
          "agenda_url": "https://www.cityofventura.ca.gov/AgendaCenter/ViewFile/Agenda/_11202025-3534",
          "minutes_url": "https://www.cityofventura.ca.gov/AgendaCenter/ViewFile/Minutes/_10012025-3502",
          "title": "Design Review Committee Special Meeting - 6:00 PM",
          "date": "2025-11-20"
        },
        {
          "meeting_url": "https://www.youtube.com/live/y_74a9Jl864?si=addSrCrUTgvGMbRs",
          "agenda_url": "https://www.cityofventura.ca.gov/AgendaCenter/ViewFile/Agenda/_11052025-3524",
          "minutes_url": "https://www.cityofventura.ca.gov/AgendaCenter/ViewFile/Minutes/_10012025-3502",
          "title": "Design Review Committee Special Meeting- 4:30 P.M. Regular Meeting 5:30 P.M.",
          "date": "2025-11-05"
        },
        {
          "meeting_url": "https://www.youtube.com/live/xxFkCHesrZg?si=udmbcjFpTc0hP92w",
          "agenda_url": "https://www.cityofventura.ca.gov/AgendaCenter/ViewFile/Agenda/_10012025-3502",
          "minutes_url": "https://www.cityofventura.ca.gov/AgendaCenter/ViewFile/Minutes/_10012025-3502",
          "title": "Design Review Committee Meeting",
          "date": "2025-10-01"
        },
        {
          "meeting_url": "https://www.youtube.com/live/3g5rcnLfOWQ?si=O8afQQRotXNuwRaX",
          "agenda_url": "https://www.cityofventura.ca.gov/AgendaCenter/ViewFile/Agenda/_09032025-3481",
          "minutes_url": "https://www.cityofventura.ca.gov/AgendaCenter/ViewFile/Minutes/_09032025-3481",
          "title": "Design Review Committee Meeting",
          "date": "2025-09-03"
        },
        {
          "meeting_url": "https://www.youtube.com/playlist?list=PL_1f7aI4La-cAdy7Nzl3ZPIF03PobjY_R",
          "agenda_url": "https://www.cityofventura.ca.gov/AgendaCenter/ViewFile/Agenda/_07162025-3451",
          "minutes_url": "https://www.cityofventura.ca.gov/AgendaCenter/ViewFile/Minutes/_07162025-3451",
          "title": "Design Review Committee - Special Meeting: Objective Design Standards - Second Open House",
          "date": "2025-07-16"
        },
        {
          "meeting_url": "https://www.youtube.com/watch?v=waxm36G_X7c&list=PL_1f7aI4La-cAdy7Nzl3ZPIF03PobjY_R",
          "agenda_url": "https://www.cityofventura.ca.gov/AgendaCenter/ViewFile/Agenda/_07022025-3440",
          "minutes_url": "https://www.cityofventura.ca.gov/AgendaCenter/ViewFile/Minutes/_07022025-3440",
          "title": "Design Review Committee Meeting",
          "date": "2025-07-02"
        },
        {
          "meeting_url": "https://www.youtube.com/live/uqsMaCsATNA?si=fEe4awE6KTqtYQcN",
          "agenda_url": "https://www.cityofventura.ca.gov/AgendaCenter/ViewFile/Agenda/_06042025-3419",
          "minutes_url": "https://www.cityofventura.ca.gov/AgendaCenter/ViewFile/Minutes/_06042025-3419",
          "title": "Design Review Committee Meeting",
          "date": "2025-06-04"
        },
        {
          "meeting_url": "https://www.youtube.com/watch?v=iICk0zajFzA&list=PL_1f7aI4La-cAdy7Nzl3ZPIF03PobjY_R",
          "agenda_url": "https://www.cityofventura.ca.gov/AgendaCenter/ViewFile/Agenda/_05072025-3397",
          "minutes_url": "https://www.cityofventura.ca.gov/AgendaCenter/ViewFile/Minutes/_05072025-3397",
          "title": "Design Review Committee Meeting",
          "date": "2025-05-07"
        },
        {
          "meeting_url": "https://www.youtube.com/watch?v=SvOQ2Ix-Or8&list=PL_1f7aI4La-cAdy7Nzl3ZPIF03PobjY_R&index=4",
          "agenda_url": "https://www.cityofventura.ca.gov/AgendaCenter/ViewFile/Agenda/_04092025-3377",
          "minutes_url": "https://www.cityofventura.ca.gov/AgendaCenter/ViewFile/Minutes/_04092025-3377",
          "title": "Design Review Committee Special Meeting - Objective Design Standards Open House",
          "date": "2025-04-09"
        },
        {
          "meeting_url": "https://www.youtube.com/watch?v=uJTVbJexdX0&list=PL_1f7aI4La-cAdy7Nzl3ZPIF03PobjY_R&index=5",
          "agenda_url": "https://www.cityofventura.ca.gov/AgendaCenter/ViewFile/Agenda/_04022025-3373",
          "minutes_url": "https://www.cityofventura.ca.gov/AgendaCenter/ViewFile/Minutes/_04022025-3373",
          "title": "Design Review Committee Meeting",
          "date": "2025-04-02"
        },
        {
          "meeting_url": "https://www.youtube.com/watch?v=auUcVHgeMQ8&list=PL_1f7aI4La-cAdy7Nzl3ZPIF03PobjY_R&index=6",
          "agenda_url": "https://www.cityofventura.ca.gov/AgendaCenter/ViewFile/Agenda/_03052025-3357",
          "minutes_url": "https://www.cityofventura.ca.gov/AgendaCenter/ViewFile/Minutes/_03052025-3357",
          "title": "Design Review Committee Meeting",
          "date": "2025-03-05"
        },
        {
          "meeting_url": "https://www.youtube.com/watch?v=AaPw-uKr6zo&list=PL_1f7aI4La-cAdy7Nzl3ZPIF03PobjY_R&index=7",
          "agenda_url": "https://www.cityofventura.ca.gov/AgendaCenter/ViewFile/Agenda/_02052025-3340",
          "minutes_url": "https://www.cityofventura.ca.gov/AgendaCenter/ViewFile/Minutes/_02052025-3340",
          "title": "Design Review Committee Meeting",
          "date": "2025-02-05"
        },
        {
          "meeting_url": "https://www.youtube.com/watch?v=-FpR099Twn4&list=PL_1f7aI4La-cAdy7Nzl3ZPIF03PobjY_R&index=8",
          "agenda_url": "https://www.cityofventura.ca.gov/AgendaCenter/ViewFile/Agenda/_01082025-3321",
          "minutes_url": "https://www.cityofventura.ca.gov/AgendaCenter/ViewFile/Minutes/_01082025-3321",
          "title": "Design Review Committee Meeting",
          "date": "2025-01-08"
        },
        {
          "meeting_url": "https://www.Youtube.com/cityofventura/live",
          "agenda_url": "https://www.cityofventura.ca.gov/AgendaCenter/ViewFile/Agenda/_11172025-3530",
          "minutes_url": "https://www.cityofventura.ca.gov/AgendaCenter/ViewFile/Minutes/_09152025-3491",
          "title": "Director's Hearing Agenda",
          "date": "2025-11-17"
        },
        {
          "meeting_url": "https://www.Youtube.com/cityofventura/live",
          "agenda_url": "https://www.cityofventura.ca.gov/AgendaCenter/ViewFile/Agenda/_10132025-3516",
          "minutes_url": "https://www.cityofventura.ca.gov/AgendaCenter/ViewFile/Minutes/_09152025-3491",
          "title": "Director's Hearing Meeting",
          "date": "2025-10-13"
        },
        {
          "meeting_url": "https://www.youtube.com/live/aoeeNEbvj58?si=6d67w_o8bg7Ttbc0",
          "agenda_url": "https://www.cityofventura.ca.gov/AgendaCenter/ViewFile/Agenda/_09152025-3491",
          "minutes_url": "https://www.cityofventura.ca.gov/AgendaCenter/ViewFile/Minutes/_09152025-3491",
          "title": "Director's Hearing Meeting",
          "date": "2025-09-15"
        },
        {
          "meeting_url": "https://www.youtube.com/live/Zv6I_sSjfeU?si=c6I0nV16GMm4yQ3x",
          "agenda_url": "https://www.cityofventura.ca.gov/AgendaCenter/ViewFile/Agenda/_08182025-3473",
          "minutes_url": "https://www.cityofventura.ca.gov/AgendaCenter/ViewFile/Minutes/_08182025-3473",
          "title": "Director's Hearing Meeting",
          "date": "2025-08-18"
        },
        {
          "meeting_url": "https://www.Youtube.com/cityofventura/live",
          "agenda_url": "https://www.cityofventura.ca.gov/AgendaCenter/ViewFile/Agenda/_07142025-3453",
          "minutes_url": "https://www.cityofventura.ca.gov/AgendaCenter/ViewFile/Minutes/_07142025-3453",
          "title": "Director's Hearing Meeting",
          "date": "2025-07-14"
        },
        {
          "meeting_url": "https://www.youtube.com/watch?v=QWtJVlnqZPo",
          "agenda_url": "https://www.cityofventura.ca.gov/AgendaCenter/ViewFile/Agenda/_06162025-3425",
          "minutes_url": "https://www.cityofventura.ca.gov/AgendaCenter/ViewFile/Minutes/_06162025-3425",
          "title": "Director's Hearing Meeting",
          "date": "2025-06-16"
        },
        {
          "meeting_url": "https://www.youtube.com/watch?v=wPaZAbn7gkA&list=PL_1f7aI4La-dtZ6kslzTFhpPimF4hVl21&index=1",
          "agenda_url": "https://www.cityofventura.ca.gov/AgendaCenter/ViewFile/Agenda/_05192025-3412",
          "minutes_url": "https://www.cityofventura.ca.gov/AgendaCenter/ViewFile/Minutes/_05192025-3412",
          "title": "Director's Hearing Meeting",
          "date": "2025-05-19"
        },
        {
          "meeting_url": "https://www.youtube.com/watch?v=bX8WEAhkiVs&list=PL_1f7aI4La-dtZ6kslzTFhpPimF4hVl21&index=1",
          "agenda_url": "https://www.cityofventura.ca.gov/AgendaCenter/ViewFile/Agenda/_04212025-3389",
          "minutes_url": "https://www.cityofventura.ca.gov/AgendaCenter/ViewFile/Minutes/_04212025-3389",
          "title": "Director's Hearing Meeting",
          "date": "2025-04-21"
        },
        {
          "meeting_url": "https://www.youtube.com/watch?v=lBVnchpTHK4&list=PL_1f7aI4La-dtZ6kslzTFhpPimF4hVl21&index=2",
          "agenda_url": "https://www.cityofventura.ca.gov/AgendaCenter/ViewFile/Agenda/_03172025-3365",
          "minutes_url": "https://www.cityofventura.ca.gov/AgendaCenter/ViewFile/Minutes/_03172025-3365",
          "title": "Director's Hearing Meeting",
          "date": "2025-03-17"
        },
        {
          "meeting_url": "https://www.youtube.com/watch?v=Mo_GknEf_Rs&list=PL_1f7aI4La-dtZ6kslzTFhpPimF4hVl21&index=3",
          "agenda_url": "https://www.cityofventura.ca.gov/AgendaCenter/ViewFile/Agenda/_02182025-3349",
          "minutes_url": "https://www.cityofventura.ca.gov/AgendaCenter/ViewFile/Minutes/_02182025-3349",
          "title": "Director's Hearing Meeting",
          "date": "2025-02-18"
        },
        {
          "meeting_url": "https://www.youtube.com/watch?v=YY83IDOeF2s&list=PL_1f7aI4La-eqjzwetRA_cgU861ULte74&index=1",
          "agenda_url": "https://www.cityofventura.ca.gov/AgendaCenter/ViewFile/Agenda/_09252025-3500",
          "minutes_url": "https://www.cityofventura.ca.gov/AgendaCenter/ViewFile/Minutes/_09252025-3500",
          "title": "Economic Development Subcommittee Special Meeting",
          "date": "2025-09-25"
        },
        {
          "meeting_url": "https://www.youtube.com/watch?v=TJyqhZVtyA8&list=PL_1f7aI4La-eqjzwetRA_cgU861ULte74&index=1",
          "agenda_url": "https://www.cityofventura.ca.gov/AgendaCenter/ViewFile/Agenda/_08282025-3480",
          "minutes_url": "https://www.cityofventura.ca.gov/AgendaCenter/ViewFile/Minutes/_08282025-3480",
          "title": "Economic Development Subcommittee Special Meeting",
          "date": "2025-08-28"
        },
        {
          "meeting_url": "https://www.youtube.com/watch?v=YY83IDOeF2s&list=PL_1f7aI4La-eqjzwetRA_cgU861ULte74&index=1",
          "agenda_url": "https://www.cityofventura.ca.gov/AgendaCenter/ViewFile/Agenda/_04102025-3381",
          "minutes_url": "https://www.cityofventura.ca.gov/AgendaCenter/ViewFile/Minutes/_04102025-3381",
          "title": "Economic Development Subcommittee Regular Meeting",
          "date": "2025-04-10"
        },
        {
          "meeting_url": "https://www.youtube.com/watch?v=yIkE2Nkmksc&list=PL_1f7aI4La-eqjzwetRA_cgU861ULte74&index=2",
          "agenda_url": "https://www.cityofventura.ca.gov/AgendaCenter/ViewFile/Agenda/_03132025-3361",
          "minutes_url": "https://www.cityofventura.ca.gov/AgendaCenter/ViewFile/Minutes/_03132025-3361",
          "title": "Economic Development Subcommittee Regular Meeting",
          "date": "2025-03-13"
        },
        {
          "meeting_url": "https://www.youtube.com/watch?v=loUMIZCoSz8&list=PL_1f7aI4La-eqjzwetRA_cgU861ULte74&index=1",
          "agenda_url": "https://www.cityofventura.ca.gov/AgendaCenter/ViewFile/Agenda/_02132025-3345",
          "minutes_url": "https://www.cityofventura.ca.gov/AgendaCenter/ViewFile/Minutes/_02132025-3345",
          "title": "Economic Development Subcommittee Regular Meeting",
          "date": "2025-02-13"
        },
        {
          "meeting_url": "https://www.youtube.com/watch?v=5VHWdH4yCII&list=PL_1f7aI4La-d5OH_9Eqe1fjScE2_xt2mW&index=1",
          "agenda_url": "https://www.cityofventura.ca.gov/AgendaCenter/ViewFile/Agenda/_05202025-3410",
          "minutes_url": "https://www.cityofventura.ca.gov/AgendaCenter/ViewFile/Minutes/_05202025-3410",
          "title": "Finance, Audit & Budget Committee Special Meeting",
          "date": "2025-05-20"
        },
        {
          "meeting_url": "https://www.youtube.com/watch?v=NVraSWQSINw&list=PL_1f7aI4La-d5OH_9Eqe1fjScE2_xt2mW&index=2",
          "agenda_url": "https://www.cityofventura.ca.gov/AgendaCenter/ViewFile/Agenda/_04152025-3384",
          "minutes_url": "https://www.cityofventura.ca.gov/AgendaCenter/ViewFile/Minutes/_04152025-3384",
          "title": "Finance, Audit & Budget Committee Special Meeting",
          "date": "2025-04-15"
        },
        {
          "meeting_url": "https://www.Youtube.com/cityofventura",
          "agenda_url": "https://www.cityofventura.ca.gov/AgendaCenter/ViewFile/Agenda/_07152025-3450",
          "minutes_url": null,
          "title": "General Plan Advisory Committee",
          "date": "2025-07-15"
        },
        {
          "meeting_url": "https://www.youtube.com/watch?v=cR-nQCeY5rs&list=PL_1f7aI4La-eF9ZZGs4ykC3MYC8wE3PKW&index=2",
          "agenda_url": "https://www.cityofventura.ca.gov/AgendaCenter/ViewFile/Agenda/_04302025-3394",
          "minutes_url": null,
          "title": "General Plan Advisory Committee Special Meeting",
          "date": "2025-04-30"
        },
        {
          "meeting_url": "https://www.youtube.com/watch?v=5T5Yq-AEP2Y&list=PL_1f7aI4La-eF9ZZGs4ykC3MYC8wE3PKW&index=3",
          "agenda_url": "https://www.cityofventura.ca.gov/AgendaCenter/ViewFile/Agenda/_01152025-3324",
          "minutes_url": null,
          "title": "General Plan Advisory Committee Meeting",
          "date": "2025-01-15"
        },
        {
          "meeting_url": "https://www.youtube.com/watch?v=gnIeM8C8wMI&list=PL_1f7aI4La-eF9ZZGs4ykC3MYC8wE3PKW&index=4",
          "agenda_url": "https://www.cityofventura.ca.gov/AgendaCenter/ViewFile/Agenda/_01132025-3322",
          "minutes_url": null,
          "title": "General Plan Advisory Committee Meeting",
          "date": "2025-01-13"
        },
        {
          "meeting_url": "https://www.youtube.com/live/3XRJViQtJZ0?si=iJiPFgnk-z-3AykE",
          "agenda_url": "https://www.cityofventura.ca.gov/AgendaCenter/ViewFile/Agenda/_11132025-3527",
          "minutes_url": "https://www.cityofventura.ca.gov/AgendaCenter/ViewFile/Minutes/_10092025-3507",
          "title": "Historic Preservation Committee Meeting",
          "date": "2025-11-13"
        },
        {
          "meeting_url": "https://www.youtube.com/live/PbjrMiK-qgc?si=T3yNJZ9qPczwb96Y",
          "agenda_url": "https://www.cityofventura.ca.gov/AgendaCenter/ViewFile/Agenda/_10092025-3507",
          "minutes_url": "https://www.cityofventura.ca.gov/AgendaCenter/ViewFile/Minutes/_10092025-3507",
          "title": "Historic Preservation Committee Meeting",
          "date": "2025-10-09"
        },
        {
          "meeting_url": "https://www.youtube.com/@cityofventura/streams",
          "agenda_url": "https://www.cityofventura.ca.gov/AgendaCenter/ViewFile/Agenda/_09112025-3485",
          "minutes_url": "https://www.cityofventura.ca.gov/AgendaCenter/ViewFile/Minutes/_09112025-3485",
          "title": "Historic Preservation Committee Meeting",
          "date": "2025-09-11"
        },
        {
          "meeting_url": "https://www.youtube.com/watch?v=1A5kDFOlQvE&list=PL_1f7aI4La-fvZ01qqWNVhHSlnAhq0mww",
          "agenda_url": "https://www.cityofventura.ca.gov/AgendaCenter/ViewFile/Agenda/_07102025-3444",
          "minutes_url": "https://www.cityofventura.ca.gov/AgendaCenter/ViewFile/Minutes/_07102025-3444",
          "title": "Historic Preservation Committee Meeting",
          "date": "2025-07-10"
        },
        {
          "meeting_url": "https://www.youtube.com/watch?v=I59dYq-PczQ&list=PL_1f7aI4La-fvZ01qqWNVhHSlnAhq0mww&index=2",
          "agenda_url": "https://www.cityofventura.ca.gov/AgendaCenter/ViewFile/Agenda/_06122025-3422",
          "minutes_url": "https://www.cityofventura.ca.gov/AgendaCenter/ViewFile/Minutes/_06122025-3422",
          "title": "Historic Preservation Committee Meeting",
          "date": "2025-06-12"
        },
        {
          "meeting_url": "https://www.youtube.com/live/8IDp4BYXAlo?si=59zAXLvgcYW-lfwU",
          "agenda_url": "https://www.cityofventura.ca.gov/AgendaCenter/ViewFile/Agenda/_04102025-3380",
          "minutes_url": "https://www.cityofventura.ca.gov/AgendaCenter/ViewFile/Minutes/_04102025-3380",
          "title": "Historic Preservation Committee Agenda",
          "date": "2025-04-10"
        },
        {
          "meeting_url": "https://www.youtube.com/live/geoD5TozyuA?si=fKDa_Hclouw7CeSC",
          "agenda_url": "https://www.cityofventura.ca.gov/AgendaCenter/ViewFile/Agenda/_03132025-3360",
          "minutes_url": "https://www.cityofventura.ca.gov/AgendaCenter/ViewFile/Minutes/_03132025-3360",
          "title": "Historic Preservation Committee Meeting",
          "date": "2025-03-13"
        },
        {
          "meeting_url": "https://www.youtube.com/live/geoD5TozyuA?si=F-XxFWZ7A-12lS3z",
          "agenda_url": "https://www.cityofventura.ca.gov/AgendaCenter/ViewFile/Agenda/_02132025-3346",
          "minutes_url": "https://www.cityofventura.ca.gov/AgendaCenter/ViewFile/Minutes/_02132025-3346",
          "title": "Historic Preservation Committee Meeting",
          "date": "2025-02-13"
        },
        {
          "meeting_url": "https://www.youtube.com/live/CSFCLFMyPmk?si=vRs2eRnXfNMMiN9K",
          "agenda_url": "https://www.cityofventura.ca.gov/AgendaCenter/ViewFile/Agenda/_01092025-3320",
          "minutes_url": "https://www.cityofventura.ca.gov/AgendaCenter/ViewFile/Minutes/_01092025-3320",
          "title": "Historic Preservation Committee Meeting",
          "date": "2025-01-09"
        },
        {
          "meeting_url": "https://www.youtube.com/watch?v=w4FS48_IZ6c&list=PL_1f7aI4La-e3apmnUQyN5p7Cl0_0nVq5",
          "agenda_url": "https://www.cityofventura.ca.gov/AgendaCenter/ViewFile/Agenda/_11192025-3532",
          "minutes_url": "https://www.cityofventura.ca.gov/AgendaCenter/ViewFile/Minutes/_10292025-3520",
          "title": "Housing & Homelessness Subcommittee",
          "date": "2025-11-19"
        },
        {
          "meeting_url": "https://www.youtube.com/watch?v=w4FS48_IZ6c&list=PL_1f7aI4La-e3apmnUQyN5p7Cl0_0nVq5",
          "agenda_url": "https://www.cityofventura.ca.gov/AgendaCenter/ViewFile/Agenda/_10292025-3520",
          "minutes_url": "https://www.cityofventura.ca.gov/AgendaCenter/ViewFile/Minutes/_10292025-3520",
          "title": "Housing & Homelessness Subcommittee Special Meeting",
          "date": "2025-10-29"
        },
        {
          "meeting_url": "https://www.youtube.com/watch?v=w4FS48_IZ6c&list=PL_1f7aI4La-e3apmnUQyN5p7Cl0_0nVq5",
          "agenda_url": "https://www.cityofventura.ca.gov/AgendaCenter/ViewFile/Agenda/_09302025-3501",
          "minutes_url": "https://www.cityofventura.ca.gov/AgendaCenter/ViewFile/Minutes/_09302025-3501",
          "title": "Housing & Homelessness Subcommittee Special Meeting",
          "date": "2025-09-30"
        },
        {
          "meeting_url": "https://www.youtube.com/watch?v=y8_Z5gpvcM8&list=PL_1f7aI4La-e3apmnUQyN5p7Cl0_0nVq5&index=2",
          "agenda_url": "https://www.cityofventura.ca.gov/AgendaCenter/ViewFile/Agenda/_08202025-3474",
          "minutes_url": "https://www.cityofventura.ca.gov/AgendaCenter/ViewFile/Minutes/_08202025-3474",
          "title": "Housing & Homelessness Subcommittee",
          "date": "2025-08-20"
        },
        {
          "meeting_url": "https://www.youtube.com/watch?v=Oj_RfHxIKso&list=PL_1f7aI4La-e3apmnUQyN5p7Cl0_0nVq5",
          "agenda_url": "https://www.cityofventura.ca.gov/AgendaCenter/ViewFile/Agenda/_06182025-3427",
          "minutes_url": "https://www.cityofventura.ca.gov/AgendaCenter/ViewFile/Minutes/_06182025-3427",
          "title": "Housing & Homelessness Subcommittee",
          "date": "2025-06-18"
        },
        {
          "meeting_url": "https://www.youtube.com/watch?v=qwknpZ-jx9E&list=PL_1f7aI4La-e3apmnUQyN5p7Cl0_0nVq5",
          "agenda_url": "https://www.cityofventura.ca.gov/AgendaCenter/ViewFile/Agenda/_05212025-3409",
          "minutes_url": "https://www.cityofventura.ca.gov/AgendaCenter/ViewFile/Minutes/_05212025-3409",
          "title": "Housing & Homelessness Subcommittee",
          "date": "2025-05-21"
        },
        {
          "meeting_url": "https://www.youtube.com/watch?v=pFMkpdgrjcs",
          "agenda_url": "https://www.cityofventura.ca.gov/AgendaCenter/ViewFile/Agenda/_04162025-3383",
          "minutes_url": "https://www.cityofventura.ca.gov/AgendaCenter/ViewFile/Minutes/_04162025-3383",
          "title": "Housing & Homelessness Subcommittee",
          "date": "2025-04-16"
        },
        {
          "meeting_url": "https://www.youtube.com/watch?v=rEnGil3pNls&list=PL_1f7aI4La-e3apmnUQyN5p7Cl0_0nVq5&index=3",
          "agenda_url": "https://www.cityofventura.ca.gov/AgendaCenter/ViewFile/Agenda/_03192025-3367",
          "minutes_url": "https://www.cityofventura.ca.gov/AgendaCenter/ViewFile/Minutes/_03192025-3367",
          "title": "Housing & Homelessness Subcommittee",
          "date": "2025-03-19"
        },
        {
          "meeting_url": "https://www.youtube.com/watch?v=hjVog137Vi0&list=PL_1f7aI4La-e3apmnUQyN5p7Cl0_0nVq5&index=4",
          "agenda_url": "https://www.cityofventura.ca.gov/AgendaCenter/ViewFile/Agenda/_01152025-3326",
          "minutes_url": "https://www.cityofventura.ca.gov/AgendaCenter/ViewFile/Minutes/_01152025-3326",
          "title": "Housing & Homelessness Subcommittee",
          "date": "2025-01-15"
        },
        {
          "meeting_url": "https://www.youtube.com/watch?v=lv6XEpBL1_I&list=PL_1f7aI4La-cjz1dBEq_zKZ_TiUyv7B4g&index=1",
          "agenda_url": "https://www.cityofventura.ca.gov/AgendaCenter/ViewFile/Agenda/_10072024-3272",
          "minutes_url": "https://www.cityofventura.ca.gov/AgendaCenter/ViewFile/Minutes/_10072024-3272",
          "title": "Main Street Moves Subcommittee Meeting",
          "date": "2024-10-07"
        },
        {
          "meeting_url": "https://www.youtube.com/watch?v=lv6XEpBL1_I&list=PL_1f7aI4La-cjz1dBEq_zKZ_TiUyv7B4g&index=1",
          "agenda_url": "https://www.cityofventura.ca.gov/AgendaCenter/ViewFile/Agenda/_10072024-3282",
          "minutes_url": "https://www.cityofventura.ca.gov/AgendaCenter/ViewFile/Minutes/_10072024-3272",
          "title": "Meeting on 2024-10-07",
          "date": "2024-10-07"
        },
        {
          "meeting_url": "https://www.youtube.com/watch?v=M5vGf03_J8g&list=PL_1f7aI4La-cjz1dBEq_zKZ_TiUyv7B4g&index=2",
          "agenda_url": "https://www.cityofventura.ca.gov/AgendaCenter/ViewFile/Agenda/_09232024-3264",
          "minutes_url": "https://www.cityofventura.ca.gov/AgendaCenter/ViewFile/Minutes/_09232024-3264",
          "title": "Main Street Moves Subcommittee Special Meeting",
          "date": "2024-09-23"
        },
        {
          "meeting_url": "https://www.youtube.com/watch?v=84IPMqGmNtg&list=PL_1f7aI4La-cjz1dBEq_zKZ_TiUyv7B4g&index=3",
          "agenda_url": "https://www.cityofventura.ca.gov/AgendaCenter/ViewFile/Agenda/_07012024-3223",
          "minutes_url": "https://www.cityofventura.ca.gov/AgendaCenter/ViewFile/Minutes/_07012024-3223",
          "title": "Main Street Moves Subcommittee Meeting",
          "date": "2024-07-01"
        },
        {
          "meeting_url": "https://www.youtube.com/watch?v=KtVmi9s6V04&list=PL_1f7aI4La-cjz1dBEq_zKZ_TiUyv7B4g&index=4",
          "agenda_url": "https://www.cityofventura.ca.gov/AgendaCenter/ViewFile/Agenda/_05062024-3184",
          "minutes_url": "https://www.cityofventura.ca.gov/AgendaCenter/ViewFile/Minutes/_05062024-3184",
          "title": "Main Street Moves Subcommittee Meeting",
          "date": "2024-05-06"
        },
        {
          "meeting_url": "https://www.youtube.com/watch?v=I4kvOBeiiAA&list=PL_1f7aI4La-cjz1dBEq_zKZ_TiUyv7B4g&index=5",
          "agenda_url": "https://www.cityofventura.ca.gov/AgendaCenter/ViewFile/Agenda/_03182024-3148",
          "minutes_url": "https://www.cityofventura.ca.gov/AgendaCenter/ViewFile/Minutes/_03182024-3148",
          "title": "Main Street Moves Subcommittee Special Meeting",
          "date": "2024-03-18"
        },
        {
          "meeting_url": "https://www.youtube.com/watch?v=GevlXAeWWjI&t=2150s",
          "agenda_url": "https://www.cityofventura.ca.gov/AgendaCenter/ViewFile/Agenda/_11032025-3523",
          "minutes_url": "https://www.cityofventura.ca.gov/AgendaCenter/ViewFile/Minutes/_02032025-3338",
          "title": "Measure O Citizens Oversight Committee - Regular Meeting",
          "date": "2025-11-03"
        },
        {
          "meeting_url": "https://www.youtube.com/watch?v=GevlXAeWWjI&t=2150s",
          "agenda_url": "https://www.cityofventura.ca.gov/AgendaCenter/ViewFile/Agenda/_05052025-3396",
          "minutes_url": "https://www.cityofventura.ca.gov/AgendaCenter/ViewFile/Minutes/_02032025-3338",
          "title": "Measure O Citizens Oversight Committee - Regular Meeting",
          "date": "2025-05-05"
        },
        {
          "meeting_url": "https://www.youtube.com/watch?v=GevlXAeWWjI&t=2150s",
          "agenda_url": "https://www.cityofventura.ca.gov/AgendaCenter/ViewFile/Agenda/_05052025-3408",
          "minutes_url": "https://www.cityofventura.ca.gov/AgendaCenter/ViewFile/Minutes/_02032025-3338",
          "title": "Measure O Citizens Oversight Committee - Supplemental Packet",
          "date": "2025-05-05"
        },
        {
          "meeting_url": "https://www.youtube.com/watch?v=GevlXAeWWjI&t=2150s",
          "agenda_url": "https://www.cityofventura.ca.gov/AgendaCenter/ViewFile/Agenda/_02032025-3338",
          "minutes_url": "https://www.cityofventura.ca.gov/AgendaCenter/ViewFile/Minutes/_02032025-3338",
          "title": "Measure O Citizens Oversight Committee - Regular Meeting",
          "date": "2025-02-03"
        },
        {
          "meeting_url": null,
          "agenda_url": "https://www.cityofventura.ca.gov/AgendaCenter/ViewFile/Agenda/_11202025-3535",
          "minutes_url": "https://www.cityofventura.ca.gov/AgendaCenter/ViewFile/Minutes/_10162025-3512",
          "title": "Parking Advisory Committee Regular Meeting for Thursday, November 20, 2025",
          "date": "2025-11-20"
        },
        {
          "meeting_url": null,
          "agenda_url": "https://www.cityofventura.ca.gov/AgendaCenter/ViewFile/Agenda/_10162025-3512",
          "minutes_url": "https://www.cityofventura.ca.gov/AgendaCenter/ViewFile/Minutes/_10162025-3512",
          "title": "Parking Advisory Committee Regular Meeting for Thursday, October 16, 2025",
          "date": "2025-10-16"
        },
        {
          "meeting_url": null,
          "agenda_url": "https://www.cityofventura.ca.gov/AgendaCenter/ViewFile/Agenda/_07172025-3449",
          "minutes_url": "https://www.cityofventura.ca.gov/AgendaCenter/ViewFile/Minutes/_07172025-3449",
          "title": "Parking Advisory Committee Regular Meeting for Thursday, July 17, 2025",
          "date": "2025-07-17"
        },
        {
          "meeting_url": null,
          "agenda_url": "https://www.cityofventura.ca.gov/AgendaCenter/ViewFile/Agenda/_05152025-3403",
          "minutes_url": "https://www.cityofventura.ca.gov/AgendaCenter/ViewFile/Minutes/_05152025-3403",
          "title": "Parking Advisory Committee Regular Meeting for Thursday, May 15, 2025",
          "date": "2025-05-15"
        },
        {
          "meeting_url": null,
          "agenda_url": "https://www.cityofventura.ca.gov/AgendaCenter/ViewFile/Agenda/_03202025-3364",
          "minutes_url": "https://www.cityofventura.ca.gov/AgendaCenter/ViewFile/Minutes/_03202025-3364",
          "title": "Parking Advisory Committee Regular Meeting for Thursday, March 20, 2025",
          "date": "2025-03-20"
        },
        {
          "meeting_url": null,
          "agenda_url": "https://www.cityofventura.ca.gov/AgendaCenter/ViewFile/Agenda/_02202025-3348",
          "minutes_url": "https://www.cityofventura.ca.gov/AgendaCenter/ViewFile/Minutes/_02202025-3348",
          "title": "Parking Advisory Committee Regular Meeting for Thursday, February 20, 2025",
          "date": "2025-02-20"
        },
        {
          "meeting_url": null,
          "agenda_url": "https://www.cityofventura.ca.gov/AgendaCenter/ViewFile/Agenda/_01162025-3327",
          "minutes_url": "https://www.cityofventura.ca.gov/AgendaCenter/ViewFile/Minutes/_01162025-3327",
          "title": "Downtown Parking Advisory Committee Regular Meeting for Thursday, January 16, 2025",
          "date": "2025-01-16"
        },
        {
          "meeting_url": "https://cityofventura.granicus.com/MediaPlayer.php?view_id=17&clip_id=2848",
          "agenda_url": "https://www.cityofventura.ca.gov/AgendaCenter/ViewFile/Agenda/_11122025-3526",
          "minutes_url": "https://www.cityofventura.ca.gov/AgendaCenter/ViewFile/Minutes/_10082025-3503",
          "title": "Parks and Recreation Commission Regular Meeting (11/12/2025)",
          "date": "2025-11-12"
        },
        {
          "meeting_url": "https://cityofventura.granicus.com/MediaPlayer.php?view_id=17&clip_id=2838",
          "agenda_url": "https://www.cityofventura.ca.gov/AgendaCenter/ViewFile/Agenda/_10082025-3503",
          "minutes_url": "https://www.cityofventura.ca.gov/AgendaCenter/ViewFile/Minutes/_10082025-3503",
          "title": "Parks and Recreation Commission Regular Meeting (10/08/2025)",
          "date": "2025-10-08"
        },
        {
          "meeting_url": "https://cityofventura.granicus.com/MediaPlayer.php?view_id=17&clip_id=2848",
          "agenda_url": "https://www.cityofventura.ca.gov/AgendaCenter/ViewFile/Agenda/_10082025-3513",
          "minutes_url": "https://www.cityofventura.ca.gov/AgendaCenter/ViewFile/Minutes/_10082025-3503",
          "title": "Parks and Recreation Commission Supplemental Packet (10/8/2025)",
          "date": "2025-10-08"
        },
        {
          "meeting_url": "https://cityofventura.granicus.com/MediaPlayer.php?view_id=17&clip_id=2848",
          "agenda_url": "https://www.cityofventura.ca.gov/AgendaCenter/ViewFile/Agenda/_09102025-3487",
          "minutes_url": "https://www.cityofventura.ca.gov/AgendaCenter/ViewFile/Minutes/_09102025-3487",
          "title": "Parks and Recreation Commission Regular Meeting (9/10/2025)",
          "date": "2025-09-10"
        },
        {
          "meeting_url": "https://cityofventura.granicus.com/MediaPlayer.php?view_id=17&clip_id=2848",
          "agenda_url": "https://www.cityofventura.ca.gov/AgendaCenter/ViewFile/Agenda/_09102025-3489",
          "minutes_url": "https://www.cityofventura.ca.gov/AgendaCenter/ViewFile/Minutes/_10082025-3503",
          "title": "Parks and Recreation Commission Supplemental Packet (9/10/2025)",
          "date": "2025-09-10"
        },
        {
          "meeting_url": "https://cityofventura.granicus.com/MediaPlayer.php?view_id=17&clip_id=2848",
          "agenda_url": "https://www.cityofventura.ca.gov/AgendaCenter/ViewFile/Agenda/_07092025-3441",
          "minutes_url": "https://www.cityofventura.ca.gov/AgendaCenter/ViewFile/Minutes/_07092025-3441",
          "title": "Parks and Recreation Commission Regular Meeting (7/9/2025)",
          "date": "2025-07-09"
        },
        {
          "meeting_url": "https://cityofventura.granicus.com/MediaPlayer.php?view_id=17&clip_id=2848",
          "agenda_url": "https://www.cityofventura.ca.gov/AgendaCenter/ViewFile/Agenda/_06252025-3434",
          "minutes_url": "https://www.cityofventura.ca.gov/AgendaCenter/ViewFile/Minutes/_10082025-3503",
          "title": "Parks and Recreation Commission Special Meeting (06/25/2025)",
          "date": "2025-06-25"
        },
        {
          "meeting_url": "https://cityofventura.granicus.com/MediaPlayer.php?view_id=17&clip_id=2848",
          "agenda_url": "https://www.cityofventura.ca.gov/AgendaCenter/ViewFile/Agenda/_06252025-3437",
          "minutes_url": "https://www.cityofventura.ca.gov/AgendaCenter/ViewFile/Minutes/_10082025-3503",
          "title": "Parks and Recreation Commission Supplemental Packet (6/25/2025)",
          "date": "2025-06-25"
        },
        {
          "meeting_url": "https://cityofventura.granicus.com/MediaPlayer.php?view_id=17&clip_id=2848",
          "agenda_url": "https://www.cityofventura.ca.gov/AgendaCenter/ViewFile/Agenda/_05142025-3405",
          "minutes_url": "https://www.cityofventura.ca.gov/AgendaCenter/ViewFile/Minutes/_05142025-3405",
          "title": "Parks and Recreation Commission Regular Meeting (5/14/2025)",
          "date": "2025-05-14"
        },
        {
          "meeting_url": "https://cityofventura.granicus.com/MediaPlayer.php?view_id=17&clip_id=2848",
          "agenda_url": "https://www.cityofventura.ca.gov/AgendaCenter/ViewFile/Agenda/_05142025-3413",
          "minutes_url": "https://www.cityofventura.ca.gov/AgendaCenter/ViewFile/Minutes/_10082025-3503",
          "title": "Parks and Recreation Commission Supplemental Packet for 5/14/2025",
          "date": "2025-05-14"
        },
        {
          "meeting_url": "https://cityofventura.granicus.com/MediaPlayer.php?view_id=17&clip_id=2848",
          "agenda_url": "https://www.cityofventura.ca.gov/AgendaCenter/ViewFile/Agenda/_04092025-3379",
          "minutes_url": "https://www.cityofventura.ca.gov/AgendaCenter/ViewFile/Minutes/_04092025-3379",
          "title": "Parks and Recreation Commission Regular Meeting (4/09/2025)",
          "date": "2025-04-09"
        },
        {
          "meeting_url": "https://cityofventura.granicus.com/MediaPlayer.php?view_id=17&clip_id=2848",
          "agenda_url": "https://www.cityofventura.ca.gov/AgendaCenter/ViewFile/Agenda/_03122025-3359",
          "minutes_url": "https://www.cityofventura.ca.gov/AgendaCenter/ViewFile/Minutes/_03122025-3359",
          "title": "Parks and Recreation Commission Regular Meeting (3/12/2025)",
          "date": "2025-03-12"
        },
        {
          "meeting_url": "https://cityofventura.granicus.com/MediaPlayer.php?view_id=17&clip_id=2848",
          "agenda_url": "https://www.cityofventura.ca.gov/AgendaCenter/ViewFile/Agenda/_03122025-3368",
          "minutes_url": "https://www.cityofventura.ca.gov/AgendaCenter/ViewFile/Minutes/_10082025-3503",
          "title": "Parks and Recreation Commission Supplemental Packet for 3/12/2025",
          "date": "2025-03-12"
        },
        {
          "meeting_url": "https://cityofventura.granicus.com/MediaPlayer.php?view_id=17&clip_id=2848",
          "agenda_url": "https://www.cityofventura.ca.gov/AgendaCenter/ViewFile/Agenda/_02122025-3342",
          "minutes_url": "https://www.cityofventura.ca.gov/AgendaCenter/ViewFile/Minutes/_02122025-3342",
          "title": "Parks and Recreation Commission Regular Meeting (2/12/2025)",
          "date": "2025-02-12"
        },
        {
          "meeting_url": "https://cityofventura.granicus.com/MediaPlayer.php?view_id=17&clip_id=2848",
          "agenda_url": "https://www.cityofventura.ca.gov/AgendaCenter/ViewFile/Agenda/_02122025-3467",
          "minutes_url": "https://www.cityofventura.ca.gov/AgendaCenter/ViewFile/Minutes/_10082025-3503",
          "title": "Parks and Recreation Commission Supplemental Packet for 2-12-2025",
          "date": "2025-02-12"
        },
        {
          "meeting_url": "https://cityofventura.granicus.com/MediaPlayer.php?view_id=17&clip_id=2848",
          "agenda_url": "https://www.cityofventura.ca.gov/AgendaCenter/ViewFile/Agenda/_01082025-3318",
          "minutes_url": "https://www.cityofventura.ca.gov/AgendaCenter/ViewFile/Minutes/_01082025-3318",
          "title": "Parks and Recreation Commission Regular Meeting (1/08/2025)",
          "date": "2025-01-08"
        },
        {
          "meeting_url": "https://www.Youtube.com/cityofventura/live",
          "agenda_url": "https://www.cityofventura.ca.gov/AgendaCenter/ViewFile/Agenda/_11192025-3533",
          "minutes_url": "https://www.cityofventura.ca.gov/AgendaCenter/ViewFile/Minutes/_10222025-3518",
          "title": "Planning Commission Agenda",
          "date": "2025-11-19"
        },
        {
          "meeting_url": "https://www.cityofventura.ca.gov/718/Videos",
          "agenda_url": "https://www.cityofventura.ca.gov/AgendaCenter/ViewFile/Agenda/_10222025-3518",
          "minutes_url": "https://www.cityofventura.ca.gov/AgendaCenter/ViewFile/Minutes/_10222025-3518",
          "title": "Planning Commission Meeting",
          "date": "2025-10-22"
        },
        {
          "meeting_url": "https://www.Youtube.com/cityofventura/live",
          "agenda_url": "https://www.cityofventura.ca.gov/AgendaCenter/ViewFile/Agenda/_09242025-3499",
          "minutes_url": "https://www.cityofventura.ca.gov/AgendaCenter/ViewFile/Minutes/_09242025-3499",
          "title": "Planning Commission Meeting - General Plan",
          "date": "2025-09-24"
        },
        {
          "meeting_url": "https://www.youtube.com/watch?v=ZPkza7UGkjg",
          "agenda_url": "https://www.cityofventura.ca.gov/AgendaCenter/ViewFile/Agenda/_08272025-3479",
          "minutes_url": "https://www.cityofventura.ca.gov/AgendaCenter/ViewFile/Minutes/_08272025-3479",
          "title": "Planning Commission Meeting",
          "date": "2025-08-27"
        },
        {
          "meeting_url": "https://www.youtube.com/watch?v=mpkbtsDc59s",
          "agenda_url": "https://www.cityofventura.ca.gov/AgendaCenter/ViewFile/Agenda/_07232025-3458",
          "minutes_url": "https://www.cityofventura.ca.gov/AgendaCenter/ViewFile/Minutes/_07232025-3458",
          "title": "Planning Commission Meeting",
          "date": "2025-07-23"
        },
        {
          "meeting_url": "https://www.youtube.com/live/EwcGvZOrmFE?si=eLdnE-4o5tau99bD",
          "agenda_url": "https://www.cityofventura.ca.gov/AgendaCenter/ViewFile/Agenda/_07212025-3457",
          "minutes_url": "https://www.cityofventura.ca.gov/AgendaCenter/ViewFile/Minutes/_07212025-3457",
          "title": "Special Planning Commission Meeting and General Plan EIR Open House",
          "date": "2025-07-21"
        },
        {
          "meeting_url": "https://www.youtube.com/live/nwal_1-Ghbc?si=Edb7T-DYBFaqxZNk",
          "agenda_url": "https://www.cityofventura.ca.gov/AgendaCenter/ViewFile/Agenda/_06172025-3428",
          "minutes_url": "https://www.cityofventura.ca.gov/AgendaCenter/ViewFile/Minutes/_06172025-3428",
          "title": "Planning Commission Special Meeting Agenda",
          "date": "2025-06-17"
        },
        {
          "meeting_url": "https://www.youtube.com/watch?v=PkUqRXY_0Tw&list=PL_1f7aI4La-coJ6A3rAPLXLw5ESUvAO11",
          "agenda_url": "https://www.cityofventura.ca.gov/AgendaCenter/ViewFile/Agenda/_05282025-3415",
          "minutes_url": "https://www.cityofventura.ca.gov/AgendaCenter/ViewFile/Minutes/_05282025-3415",
          "title": "Planning Commission Meeting",
          "date": "2025-05-28"
        },
        {
          "meeting_url": "https://www.youtube.com/watch?v=YAZAXxPXf9Q&list=PL_1f7aI4La-coJ6A3rAPLXLw5ESUvAO11&index=1",
          "agenda_url": "https://www.cityofventura.ca.gov/AgendaCenter/ViewFile/Agenda/_04232025-3388",
          "minutes_url": "https://www.cityofventura.ca.gov/AgendaCenter/ViewFile/Minutes/_04232025-3388",
          "title": "Planning Commission Meeting",
          "date": "2025-04-23"
        },
        {
          "meeting_url": "https://www.youtube.com/watch?v=2SqelqQstcE&list=PL_1f7aI4La-coJ6A3rAPLXLw5ESUvAO11&index=51",
          "agenda_url": "https://www.cityofventura.ca.gov/AgendaCenter/ViewFile/Agenda/_04012025-3374",
          "minutes_url": "https://www.cityofventura.ca.gov/AgendaCenter/ViewFile/Minutes/_04012025-3374",
          "title": "Planning Commission Special Meeting",
          "date": "2025-04-01"
        },
        {
          "meeting_url": "https://www.youtube.com/watch?v=G28_wWvPR2Y",
          "agenda_url": "https://www.cityofventura.ca.gov/AgendaCenter/ViewFile/Agenda/_03262025-3372",
          "minutes_url": "https://www.cityofventura.ca.gov/AgendaCenter/ViewFile/Minutes/_03262025-3372",
          "title": "Planning Commission Meeting",
          "date": "2025-03-26"
        },
        {
          "meeting_url": "https://www.youtube.com/watch?v=R5gMp3lNlWk&list=PL_1f7aI4La-coJ6A3rAPLXLw5ESUvAO11&index=2",
          "agenda_url": "https://www.cityofventura.ca.gov/AgendaCenter/ViewFile/Agenda/_03042025-3356",
          "minutes_url": "https://www.cityofventura.ca.gov/AgendaCenter/ViewFile/Minutes/_03042025-3356",
          "title": "Planning Commission Special Meeting",
          "date": "2025-03-04"
        },
        {
          "meeting_url": "https://www.youtube.com/watch?v=t3H7lQi1MM8&list=PL_1f7aI4La-coJ6A3rAPLXLw5ESUvAO11&index=3",
          "agenda_url": "https://www.cityofventura.ca.gov/AgendaCenter/ViewFile/Agenda/_02262025-3355",
          "minutes_url": "https://www.cityofventura.ca.gov/AgendaCenter/ViewFile/Minutes/_02262025-3355",
          "title": "Planning Commission Meeting",
          "date": "2025-02-26"
        },
        {
          "meeting_url": "https://www.youtube.com/watch?v=gcCBfIQL69s&list=PL_1f7aI4La-coJ6A3rAPLXLw5ESUvAO11&index=4",
          "agenda_url": "https://www.cityofventura.ca.gov/AgendaCenter/ViewFile/Agenda/_01222025-3330",
          "minutes_url": "https://www.cityofventura.ca.gov/AgendaCenter/ViewFile/Minutes/_01222025-3330",
          "title": "Planning Commission Meeting",
          "date": "2025-01-22"
        },
        {
          "meeting_url": "https://www.youtube.com/live/bIogO2D5Vlc?si=8cioXRc0OwpouPvO",
          "agenda_url": "https://www.cityofventura.ca.gov/AgendaCenter/ViewFile/Agenda/_10272025-3521",
          "minutes_url": "https://www.cityofventura.ca.gov/AgendaCenter/ViewFile/Minutes/_08252025-3478",
          "title": "Water Commission Agenda October 27, 2025 Regular Meeting",
          "date": "2025-10-27"
        },
        {
          "meeting_url": "https://www.youtube.com/watch?v=mE5etmfH49U&list=PL_1f7aI4La-fl9iVSCy_BH6nGDm2gBgYQ&index=1",
          "agenda_url": "https://www.cityofventura.ca.gov/AgendaCenter/ViewFile/Agenda/_09222025-3498",
          "minutes_url": "https://www.cityofventura.ca.gov/AgendaCenter/ViewFile/Minutes/_08252025-3478",
          "title": "Water Commission Agenda September 22, 2025 Regular Meeting",
          "date": "2025-09-22"
        },
        {
          "meeting_url": "https://www.youtube.com/watch?v=7BacSOOVw4I&list=PL_1f7aI4La-fl9iVSCy_BH6nGDm2gBgYQ&index=2",
          "agenda_url": "https://www.cityofventura.ca.gov/AgendaCenter/ViewFile/Agenda/_09082025-3486",
          "minutes_url": "https://www.cityofventura.ca.gov/AgendaCenter/ViewFile/Minutes/_08252025-3478",
          "title": "Water Commission Agenda September 8, 2025 Special Meeting",
          "date": "2025-09-08"
        },
        {
          "meeting_url": "https://www.youtube.com/watch?v=gkUVuHD2UK8&list=PL_1f7aI4La-fl9iVSCy_BH6nGDm2gBgYQ&index=3",
          "agenda_url": "https://www.cityofventura.ca.gov/AgendaCenter/ViewFile/Agenda/_08252025-3478",
          "minutes_url": "https://www.cityofventura.ca.gov/AgendaCenter/ViewFile/Minutes/_08252025-3478",
          "title": "Water Commission Agenda August 25, 2025 Regular Meeting",
          "date": "2025-08-25"
        },
        {
          "meeting_url": "https://www.youtube.com/watch?v=8esW956HvxY&list=PL_1f7aI4La-fl9iVSCy_BH6nGDm2gBgYQ",
          "agenda_url": "https://www.cityofventura.ca.gov/AgendaCenter/ViewFile/Agenda/_08072025-3464",
          "minutes_url": "https://www.cityofventura.ca.gov/AgendaCenter/ViewFile/Minutes/_08252025-3478",
          "title": "Water Commission Agenda August 7, 2025 Special Meeting",
          "date": "2025-08-07"
        },
        {
          "meeting_url": "https://www.youtube.com/watch?v=TAJenpNZ2aA",
          "agenda_url": "https://www.cityofventura.ca.gov/AgendaCenter/ViewFile/Agenda/_06232025-3431",
          "minutes_url": "https://www.cityofventura.ca.gov/AgendaCenter/ViewFile/Minutes/_06232025-3431",
          "title": "Water Commission Agenda June 23, 2025 Regular Meeting",
          "date": "2025-06-23"
        },
        {
          "meeting_url": "https://www.youtube.com/watch?v=PDZ7nsdKYX0",
          "agenda_url": "https://www.cityofventura.ca.gov/AgendaCenter/ViewFile/Agenda/_05192025-3411",
          "minutes_url": "https://www.cityofventura.ca.gov/AgendaCenter/ViewFile/Minutes/_05192025-3411",
          "title": "Water Commission Agenda May 19, 2025 Regular Meeting",
          "date": "2025-05-19"
        },
        {
          "meeting_url": "https://www.youtube.com/watch?v=QGZzl0Fq7gE&list=PL_1f7aI4La-fl9iVSCy_BH6nGDm2gBgYQ",
          "agenda_url": "https://www.cityofventura.ca.gov/AgendaCenter/ViewFile/Agenda/_04282025-3393",
          "minutes_url": "https://www.cityofventura.ca.gov/AgendaCenter/ViewFile/Minutes/_04282025-3393",
          "title": "Water Commission Agenda April 28, 2025 Regular Meeting",
          "date": "2025-04-28"
        },
        {
          "meeting_url": "https://www.youtube.com/watch?v=jj3LKUgU-XY&list=PL_1f7aI4La-fl9iVSCy_BH6nGDm2gBgYQ",
          "agenda_url": "https://www.cityofventura.ca.gov/AgendaCenter/ViewFile/Agenda/_03242025-3371",
          "minutes_url": "https://www.cityofventura.ca.gov/AgendaCenter/ViewFile/Minutes/_03242025-3371",
          "title": "Water Commission Agenda March 24, 2025 Regular Meeting - Amended 3/24/2025 - Supplemental Packet Posted",
          "date": "2025-03-24"
        },
        {
          "meeting_url": "https://www.youtube.com/live/bIogO2D5Vlc?si=8cioXRc0OwpouPvO",
          "agenda_url": "https://www.cityofventura.ca.gov/AgendaCenter/ViewFile/Agenda/_02242025-3351",
          "minutes_url": "https://www.cityofventura.ca.gov/AgendaCenter/ViewFile/Minutes/_08252025-3478",
          "title": "ADVANCED AGENDA ITEM - PSA for Katz and Associates Strategic Communications Planning and Outreach Questionnaire",
          "date": "2025-02-24"
        },
        {
          "meeting_url": "https://youtube.com/live/y7Ef5D2JDAk?feature=share",
          "agenda_url": "https://www.cityofventura.ca.gov/AgendaCenter/ViewFile/Agenda/_02242025-3354",
          "minutes_url": "https://www.cityofventura.ca.gov/AgendaCenter/ViewFile/Minutes/_02242025-3354",
          "title": "Water Commission Agenda February 24, 2025 Regular Meeting - Supplemental Packet Posted",
          "date": "2025-02-24"
        },
        {
          "meeting_url": "https://www.youtube.com/live/bIogO2D5Vlc?si=8cioXRc0OwpouPvO",
          "agenda_url": "https://www.cityofventura.ca.gov/AgendaCenter/ViewFile/Agenda/_01272025-3317",
          "minutes_url": "https://www.cityofventura.ca.gov/AgendaCenter/ViewFile/Minutes/_08252025-3478",
          "title": "ADVANCED AGENDA ITEM - 2025 Water and Wastewater Rate Study",
          "date": "2025-01-27"
        },
        {
          "meeting_url": "https://youtube.com/live/WcboVe-SgRw?feature=share",
          "agenda_url": "https://www.cityofventura.ca.gov/AgendaCenter/ViewFile/Agenda/_01272025-3335",
          "minutes_url": "https://www.cityofventura.ca.gov/AgendaCenter/ViewFile/Minutes/_01272025-3335",
          "title": "Water Commission Agenda January 27, 2025 Regular Meeting",
          "date": "2025-01-27"
        },
        {
          "meeting_url": "https://cityofventura.granicus.com/MediaPlayer.php?view_id=17&clip_id=2846",
          "agenda_url": "https://www.cityofventura.ca.gov/AgendaCenter/ViewFile/Agenda/_06122025-3423",
          "minutes_url": "https://www.cityofventura.ca.gov/AgendaCenter/ViewFile/Minutes/_10092025-3505",
          "title": "Notice of Cancellation for the Arts and Culture Commission Meeting",
          "date": "2025-06-12"
        },
        {
          "meeting_url": "https://www.youtube.com/watch?v=2P9eZmt6GAk",
          "agenda_url": "https://www.cityofventura.ca.gov/AgendaCenter/ViewFile/Agenda/_10062025-3508",
          "minutes_url": "https://www.cityofventura.ca.gov/AgendaCenter/ViewFile/Minutes/_07072025-3445",
          "title": "City Council Rules Committee Regular Meeting - CANCELLED",
          "date": "2025-10-06"
        },
        {
          "meeting_url": "https://www.youtube.com/live/ZdRwqSr8sdM?si=uI5pFQf3ibwzH1rz",
          "agenda_url": "https://www.cityofventura.ca.gov/AgendaCenter/ViewFile/Agenda/_08062025-3460",
          "minutes_url": "https://www.cityofventura.ca.gov/AgendaCenter/ViewFile/Minutes/_10012025-3502",
          "title": "Design Review Committee Meeting - CANCELLED",
          "date": "2025-08-06"
        },
        {
          "meeting_url": "https://www.Youtube.com/cityofventura/live",
          "agenda_url": "https://www.cityofventura.ca.gov/AgendaCenter/ViewFile/Agenda/_01292025-3331",
          "minutes_url": "https://www.cityofventura.ca.gov/AgendaCenter/ViewFile/Minutes/_09152025-3491",
          "title": "Director's Hearing Meeting - Cancelled",
          "date": "2025-01-29"
        },
        {
          "meeting_url": "https://www.youtube.com/watch?v=YY83IDOeF2s&list=PL_1f7aI4La-eqjzwetRA_cgU861ULte74&index=1",
          "agenda_url": "https://www.cityofventura.ca.gov/AgendaCenter/ViewFile/Agenda/_10092025-3497",
          "minutes_url": "https://www.cityofventura.ca.gov/AgendaCenter/ViewFile/Minutes/_09252025-3500",
          "title": "Economic Development Subcommittee Regular Meeting - CANCELLED",
          "date": "2025-10-09"
        },
        {
          "meeting_url": "https://www.youtube.com/watch?v=YY83IDOeF2s&list=PL_1f7aI4La-eqjzwetRA_cgU861ULte74&index=1",
          "agenda_url": "https://www.cityofventura.ca.gov/AgendaCenter/ViewFile/Agenda/_06122025-3424",
          "minutes_url": "https://www.cityofventura.ca.gov/AgendaCenter/ViewFile/Minutes/_09252025-3500",
          "title": "Economic Development Subcommittee Regular Meeting - CANCELLED",
          "date": "2025-06-12"
        },
        {
          "meeting_url": "https://www.youtube.com/live/3XRJViQtJZ0?si=iJiPFgnk-z-3AykE",
          "agenda_url": "https://www.cityofventura.ca.gov/AgendaCenter/ViewFile/Agenda/_08142025-3459",
          "minutes_url": "https://www.cityofventura.ca.gov/AgendaCenter/ViewFile/Minutes/_08142025-3459",
          "title": "Historic Preservation Committee Meeting - Cancelled",
          "date": "2025-08-14"
        },
        {
          "meeting_url": "https://www.youtube.com/live/3XRJViQtJZ0?si=iJiPFgnk-z-3AykE",
          "agenda_url": "https://www.cityofventura.ca.gov/AgendaCenter/ViewFile/Agenda/_05082025-3392",
          "minutes_url": "https://www.cityofventura.ca.gov/AgendaCenter/ViewFile/Minutes/_10092025-3507",
          "title": "Historic Preservation Committee Meeting - Cancelled",
          "date": "2025-05-08"
        },
        {
          "meeting_url": "https://www.youtube.com/watch?v=w4FS48_IZ6c&list=PL_1f7aI4La-e3apmnUQyN5p7Cl0_0nVq5",
          "agenda_url": "https://www.cityofventura.ca.gov/AgendaCenter/ViewFile/Agenda/_10152025-3509",
          "minutes_url": "https://www.cityofventura.ca.gov/AgendaCenter/ViewFile/Minutes/_10292025-3520",
          "title": "Housing & Homelessness Subcommittee Meeting - CANCELLED",
          "date": "2025-10-15"
        },
        {
          "meeting_url": "https://www.youtube.com/watch?v=w4FS48_IZ6c&list=PL_1f7aI4La-e3apmnUQyN5p7Cl0_0nVq5",
          "agenda_url": "https://www.cityofventura.ca.gov/AgendaCenter/ViewFile/Agenda/_02192025-3350",
          "minutes_url": "https://www.cityofventura.ca.gov/AgendaCenter/ViewFile/Minutes/_10292025-3520",
          "title": "Housing & Homelessness Subcommittee - Meeting CANCELLATION",
          "date": "2025-02-19"
        },
        {
          "meeting_url": "https://www.youtube.com/watch?v=lv6XEpBL1_I&list=PL_1f7aI4La-cjz1dBEq_zKZ_TiUyv7B4g&index=1",
          "agenda_url": "https://www.cityofventura.ca.gov/AgendaCenter/ViewFile/Agenda/_06032024-3208",
          "minutes_url": "https://www.cityofventura.ca.gov/AgendaCenter/ViewFile/Minutes/_10072024-3272",
          "title": "Main Street Moves Subcommittee Meeting - CANCELLED",
          "date": "2024-05-31"
        },
        {
          "meeting_url": "https://www.youtube.com/watch?v=GevlXAeWWjI&t=2150s",
          "agenda_url": "https://www.cityofventura.ca.gov/AgendaCenter/ViewFile/Agenda/_08042025-3461",
          "minutes_url": "https://www.cityofventura.ca.gov/AgendaCenter/ViewFile/Minutes/_02032025-3338",
          "title": "CANCELLATION NOTICE - Measure O Citizens Oversight Committee, Regular Meeting on Monday, August 4, 2025",
          "date": "2025-08-04"
        },
        {
          "meeting_url": null,
          "agenda_url": "https://www.cityofventura.ca.gov/AgendaCenter/ViewFile/Agenda/_09182025-3493",
          "minutes_url": "https://www.cityofventura.ca.gov/AgendaCenter/ViewFile/Minutes/_10162025-3512",
          "title": "Parking Advisory Committee Regular Meeting for Thursday, September 18, 2025 CANCELLED",
          "date": "2025-09-18"
        },
        {
          "meeting_url": null,
          "agenda_url": "https://www.cityofventura.ca.gov/AgendaCenter/ViewFile/Agenda/_08212025-3465",
          "minutes_url": "https://www.cityofventura.ca.gov/AgendaCenter/ViewFile/Minutes/_10162025-3512",
          "title": "Parking Advisory Committee Regular Meeting for Thursday, August 21, 2025 CANCELLED",
          "date": "2025-08-21"
        },
        {
          "meeting_url": null,
          "agenda_url": "https://www.cityofventura.ca.gov/AgendaCenter/ViewFile/Agenda/_06192025-3430",
          "minutes_url": "https://www.cityofventura.ca.gov/AgendaCenter/ViewFile/Minutes/_10162025-3512",
          "title": "Parking Advisory Committee Regular Meeting for Thursday, June 19, 2025 CANCELLED",
          "date": "2025-06-19"
        },
        {
          "meeting_url": null,
          "agenda_url": "https://www.cityofventura.ca.gov/AgendaCenter/ViewFile/Agenda/_04172025-3385",
          "minutes_url": "https://www.cityofventura.ca.gov/AgendaCenter/ViewFile/Minutes/_10162025-3512",
          "title": "Parking Advisory Committee Regular Meeting for Thursday, April17, 2025 CANCELLED",
          "date": "2025-04-17"
        },
        {
          "meeting_url": "https://cityofventura.granicus.com/MediaPlayer.php?view_id=17&clip_id=2848",
          "agenda_url": "https://www.cityofventura.ca.gov/AgendaCenter/ViewFile/Agenda/_08132025-3455",
          "minutes_url": "https://www.cityofventura.ca.gov/AgendaCenter/ViewFile/Minutes/_10082025-3503",
          "title": "Notice of Cancellation for the Parks and Recreation Commission Meeting scheduled for August 13, 2025",
          "date": "2025-08-13"
        },
        {
          "meeting_url": "https://cityofventura.granicus.com/MediaPlayer.php?view_id=17&clip_id=2848",
          "agenda_url": "https://www.cityofventura.ca.gov/AgendaCenter/ViewFile/Agenda/_06112025-3417",
          "minutes_url": "https://www.cityofventura.ca.gov/AgendaCenter/ViewFile/Minutes/_10082025-3503",
          "title": "Notice of Cancellation for the Parks and Recreation Commission Meeting scheduled for June 11, 2025",
          "date": "2025-05-29"
        },
        {
          "meeting_url": "https://www.Youtube.com/cityofventura/live",
          "agenda_url": "https://www.cityofventura.ca.gov/AgendaCenter/ViewFile/Agenda/_09252025-3496",
          "minutes_url": "https://www.cityofventura.ca.gov/AgendaCenter/ViewFile/Minutes/_10222025-3518",
          "title": "Planning Commission Special Meeting - Cancelled",
          "date": "2025-09-25"
        },
        {
          "meeting_url": "https://www.Youtube.com/cityofventura/live",
          "agenda_url": "https://www.cityofventura.ca.gov/AgendaCenter/ViewFile/Agenda/_06252025-3426",
          "minutes_url": "https://www.cityofventura.ca.gov/AgendaCenter/ViewFile/Minutes/_10222025-3518",
          "title": "Planning Commission Meeting - Cancelled",
          "date": "2025-06-25"
        },
        {
          "meeting_url": "https://www.youtube.com/live/bIogO2D5Vlc?si=8cioXRc0OwpouPvO",
          "agenda_url": "https://www.cityofventura.ca.gov/AgendaCenter/ViewFile/Agenda/_07282025-3456",
          "minutes_url": "https://www.cityofventura.ca.gov/AgendaCenter/ViewFile/Minutes/_08252025-3478",
          "title": "Notice of Cancellation of Regular Water Commission Meeting for July 28, 2025",
          "date": "2025-07-28"
        },
        {
          "meeting_url": "https://www.youtube.com/watch?v=3uQyYOUPCSw",
          "agenda_url": "https://www.cityofventura.ca.gov/1841/Supplemental-Packets-Hearing-Notices",
          "minutes_url": "https://www.cityofventura.ca.gov/AgendaCenter/ViewFile/Minutes/_11042025-3522",
          "title": "City Council Closed Session/Regular Meeting",
          "date": "2025-11-13"
        },
        {
          "meeting_url": "http://www.adobe.com/products/acrobat/readstep2.html",
          "agenda_url": "https://www.cityofventura.ca.gov/1841/Supplemental-Packets-Hearing-Notices",
          "minutes_url": "https://www.cityofventura.ca.gov/1829/City-Council-Meeting-Electronic-Comment-",
          "title": "Search Agendas by:",
          "date": "2025-11-20"
        },
        {
          "meeting_url": null,
          "agenda_url": "https://www.cityofventura.ca.gov/AgendaCenter/ViewFile/Agenda/_10072024-3282",
          "minutes_url": null,
          "title": "Supplemental Packet (10/07/2024)",
          "date": "2024-10-07"
        },
        {
          "meeting_url": null,
          "agenda_url": "https://www.cityofventura.ca.gov/AgendaCenter/ViewFile/Agenda/_06112025-3417",
          "minutes_url": null,
          "title": "Notice of Cancellation for the Parks and Recreation Commission Meeting scheduled for June 11, 2025",
          "date": "2025-06-11"
        },
        {
          "meeting_url": null,
          "agenda_url": "https://www.cityofventura.ca.gov/AgendaCenter/ViewFile/ArchivedAgenda/_11182025-3653",
          "minutes_url": null,
          "title": "City Council Closed Session/Regular Meeting",
          "date": "2025-11-18"
        },
        {
          "meeting_url": null,
          "agenda_url": "https://www.cityofventura.ca.gov/AgendaCenter/ViewFile/ArchivedAgenda/_11182025-3652",
          "minutes_url": null,
          "title": "City Council Closed Session/Regular Meeting",
          "date": "2025-11-18"
        },
        {
          "meeting_url": null,
          "agenda_url": "https://www.cityofventura.ca.gov/AgendaCenter/ViewFile/ArchivedAgenda/_11182025-3644",
          "minutes_url": null,
          "title": "City Council Closed Session/Regular Meeting",
          "date": "2025-11-18"
        },
        {
          "meeting_url": "https://www.cityofventura.ca.gov/1829/City-Council-Meeting-Electronic-Comment-",
          "agenda_url": "https://www.cityofventura.ca.gov/1841/Supplemental-Packets-Hearing-Notices",
          "minutes_url": "http://www.adobe.com/products/acrobat/readstep2.html",
          "title": "Back to all agendas",
          "date": "2025-11-18"
        },
        {
          "meeting_url": null,
          "agenda_url": null,
          "minutes_url": null,
          "title": "Meeting on 2025-11-16",
          "date": "2025-11-16"
        },
        {
          "meeting_url": null,
          "agenda_url": null,
          "minutes_url": null,
          "title": "Meeting on 2025-11-23",
          "date": "2025-11-23"
        },
        {
          "meeting_url": null,
          "agenda_url": null,
          "minutes_url": null,
          "title": "Meeting on 2025-11-30",
          "date": "2025-11-30"
        },
        {
          "meeting_url": null,
          "agenda_url": null,
          "minutes_url": null,
          "title": "Housing and Homelessness Subcommittee",
          "date": "2025-11-19"
        },
        {
          "meeting_url": null,
          "agenda_url": null,
          "minutes_url": null,
          "title": "Planning Commission",
          "date": "2025-11-19"
        },
        {
          "meeting_url": null,
          "agenda_url": null,
          "minutes_url": null,
          "title": "Parking Advisory Committee Regular Meeting",
          "date": "2025-11-20"
        },
        {
          "meeting_url": "https://www.youtube.com/cityofventura/live",
          "agenda_url": "https://www.cityofventura.ca.gov/list.aspx#agendaCenter",
          "minutes_url": "http://www.cityofventura.ca.gov/publicinput",
          "title": "Upcoming Public Meetings",
          "date": "2025-10-26"
        },
        {
          "meeting_url": null,
          "agenda_url": null,
          "minutes_url": null,
          "title": "Housing and Homelessness Subcommittee",
          "date": "2025-10-26"
        },
        {
          "meeting_url": null,
          "agenda_url": null,
          "minutes_url": null,
          "title": "November 2025",
          "date": "2025-10-26"
        },
        {
          "meeting_url": "https://www.youtube.com/cityofventura/live",
          "agenda_url": "https://www.cityofventura.ca.gov/list.aspx#agendaCenter",
          "minutes_url": "http://www.cityofventura.ca.gov/publicinput",
          "title": "Last Content Update:",
          "date": "2025-06-26"
        }
      ]
    },
    {
      "base_url": "https://sanduskycountyoh.gov/index.php?page=2024-minutes",
      "medias": []
    },
    {
      "base_url": "https://www.cityofsanteeca.gov/city-clerk/agendas-minutes",
      "medias": [
        {
          "meeting_url": "https://cityofsantee.cablecast.tv/CablecastPublicSite/show/2178?site=1",
          "agenda_url": "https://www.cityofsanteeca.gov/documents/city-clerk/council-agendas/2025/11-12-2025-agenda-packet.pdf",
          "minutes_url": "https://www.cityofsanteeca.gov/documents/city-clerk/council-agendas/2025/11-12-2025-non-agenda-correspondence.pdf",
          "title": "Meeting on 2025-12-10",
          "date": "2025-12-10"
        },
        {
          "meeting_url": "https://cityofsantee.cablecast.tv/CablecastPublicSite/show/2178?site=1",
          "agenda_url": "https://www.cityofsanteeca.gov/documents/city-clerk/council-agendas/2025/11-12-2025-agenda-packet.pdf",
          "minutes_url": "https://www.cityofsanteeca.gov/documents/city-clerk/council-agendas/2025/11-12-2025-non-agenda-correspondence.pdf",
          "title": "Non-Agenda Correspondence",
          "date": "2025-11-12"
        },
        {
          "meeting_url": "https://cityofsantee.cablecast.tv/CablecastPublicSite/show/2167?site=1",
          "agenda_url": "https://www.cityofsanteeca.gov/documents/city-clerk/council-agendas/2025/10-22-2025-agenda-packet.pdf",
          "minutes_url": "https://www.cityofsanteeca.gov/documents/city-clerk/council-agendas/2025/10-22-2025-dif-report-notice-of-review-2025.pdf",
          "title": "Meeting on 2025-10-22",
          "date": "2025-10-22"
        },
        {
